source_date,category,category_date,category_id,match_id,date,time,status,localteam_name,local_id,awayteam_name,away_id,local_winner,away_winner,win_type,win_round,win_minute,won_by_ko_type,won_by_ko_target,win_sub_type,win_points_score,local_strikes_total_head,local_strikes_total_body,local_strikes_total_leg,local_strikes_power_head,local_strikes_power_body,local_strikes_power_leg,local_takedowns_att,local_takedowns_landed,local_submissions,local_control_time,local_knockdowns,away_strikes_total_head,away_strikes_total_body,away_strikes_total_leg,away_strikes_power_head,away_strikes_power_body,away_strikes_power_leg,away_takedowns_att,away_takedowns_landed,away_submissions,away_control_time,away_knockdowns
14.01.2018,UFC Fight Night: Stephens vs. Choi,14.01.2018,96837,96838,2018-01-14,11:30,Final,Kalindra Faria,96682,Jessica Eye,84858,False,True,S Dec,3,5:00,,,,,58.0,8.0,4.0,28.0,6.0,4.0,2.0,1.0,1.0,0:00,0.0,42.0,4.0,3.0,20.0,2.0,3.0,4.0,3.0,6.0,0:00,0.0
14.01.2018,UFC Fight Night: Stephens vs. Choi,14.01.2018,96837,96839,2018-01-14,11:30,Final,Danielle Taylor,96070,JJ Aldrich,84542,False,True,Points,3,5:00,,,,"29-28, 29-28, 29-28",107.0,17.0,12.0,21.0,8.0,9.0,1.0,0.0,0.0,0:00,0.0,137.0,10.0,3.0,47.0,5.0,2.0,5.0,1.0,0.0,0:00,0.0
14.01.2018,UFC Fight Night: Stephens vs. Choi,14.01.2018,96837,96840,2018-01-14,11:30,Final,Mads Burnell,96622,Mike Santiago,96605,True,False,Points,3,5:00,,,,"28-29, 28-29, 28-29",34.0,0.0,0.0,20.0,0.0,0.0,7.0,3.0,1.0,0:00,0.0,56.0,14.0,9.0,34.0,11.0,6.0,3.0,3.0,2.0,0:00,0.0
14.01.2018,UFC Fight Night: Stephens vs. Choi,14.01.2018,96837,96841,2018-01-14,11:30,Final,Alex White,84604,James Krause,85560,False,True,Points,3,5:00,,,,"29-28, 29-28, 29-28",109.0,17.0,1.0,42.0,14.0,0.0,1.0,1.0,0.0,0:00,0.0,60.0,4.0,3.0,30.0,3.0,2.0,11.0,3.0,2.0,0:00,0.0
14.01.2018,UFC Fight Night: Stephens vs. Choi,14.01.2018,96837,96842,2018-01-14,11:30,Final,Matt Frevola,84768,Polo Reyes,84436,False,True,KO,1,1:00,Punch,,,,26.0,4.0,0.0,5.0,4.0,0.0,0.0,0.0,0.0,0:00,0.0,38.0,1.0,0.0,17.0,1.0,0.0,0.0,0.0,0.0,0:00,2.0
14.01.2018,UFC Fight Night: Stephens vs. Choi,14.01.2018,96837,96843,2018-01-14,11:30,Final,Talita Bernardo,84817,Irene Aldana,84820,False,True,Points,3,5:00,,,,"30-27, 30-27, 30-27",69.0,4.0,14.0,31.0,3.0,12.0,11.0,1.0,0.0,0:00,0.0,153.0,13.0,5.0,57.0,10.0,3.0,2.0,1.0,0.0,0:00,0.0
14.01.2018,UFC Fight Night: Stephens vs. Choi,14.01.2018,96837,96844,2018-01-14,11:30,Final,Guido Cannetti,86719,Kyung Ho Kang,84353,False,True,SUB,1,4:53,,,Triangle Choke,,29.0,7.0,3.0,12.0,4.0,3.0,2.0,1.0,0.0,0:00,0.0,9.0,2.0,0.0,3.0,0.0,0.0,2.0,1.0,1.0,0:00,0.0
14.01.2018,UFC Fight Night: Stephens vs. Choi,14.01.2018,96837,96845,2018-01-14,11:30,Final,Dooho Choi,86624,Jeremy Stephens,84466,False,True,KO,2,2:36,Punch,,,,51.0,7.0,21.0,24.0,3.0,17.0,0.0,0.0,0.0,0:00,0.0,111.0,6.0,16.0,32.0,6.0,11.0,0.0,0.0,0.0,0:00,1.0
14.01.2018,UFC Fight Night: Stephens vs. Choi,14.01.2018,96837,96846,2018-01-14,11:30,Final,Jessica-Rose Clark,84816,Paige VanZant,84290,True,False,Points,3,5:00,,,,"28-29, 28-29, 27-30",71.0,19.0,8.0,36.0,12.0,7.0,3.0,2.0,1.0,0:00,0.0,75.0,32.0,11.0,29.0,18.0,7.0,2.0,0.0,0.0,0:00,0.0
14.01.2018,UFC Fight Night: Stephens vs. Choi,14.01.2018,96837,96847,2018-01-14,11:30,Final,Emil Meek,86689,Kamaru Usman,84460,False,True,Points,3,5:00,,,,"30-27, 30-27, 30-27",54.0,10.0,3.0,20.0,7.0,3.0,0.0,0.0,2.0,0:00,0.0,44.0,10.0,12.0,29.0,9.0,12.0,19.0,8.0,0.0,0:00,0.0
14.01.2018,UFC Fight Night: Stephens vs. Choi,14.01.2018,96837,96848,2018-01-14,11:30,Final,Darren Elkins,85074,Michael Johnson,84743,True,False,SUB,2,2:22,,,Rear Naked Choke,,57.0,7.0,0.0,13.0,5.0,0.0,4.0,1.0,1.0,0:00,0.0,74.0,13.0,11.0,29.0,9.0,7.0,0.0,0.0,0.0,0:00,0.0
19.01.2018,UFC 220: Miocic vs. Ngannou,19.01.2018,96849,96860,2018-01-19,22:00,Final,Rob Font,85000,Thomas Almeida,84442,True,False,KO,2,2:24,Kick,,,,120.0,9.0,3.0,35.0,4.0,2.0,3.0,1.0,0.0,0:00,2.0,66.0,8.0,16.0,11.0,2.0,11.0,0.0,0.0,0.0,0:00,0.0
19.01.2018,UFC 220: Miocic vs. Ngannou,19.01.2018,96849,96859,2018-01-19,22:00,Final,Francimar Barroso,91430,Gian Villante,84417,False,True,S Dec,3,5:00,,,,,86.0,24.0,18.0,38.0,18.0,18.0,0.0,0.0,0.0,0:00,0.0,184.0,17.0,8.0,57.0,11.0,6.0,0.0,0.0,0.0,0:00,0.0
19.01.2018,UFC 220: Miocic vs. Ngannou,19.01.2018,96849,96858,2018-01-19,22:00,Final,Shane Burgos,84811,Calvin Kattar,84921,False,True,KO,3,0:32,Punch,,,,126.0,38.0,22.0,46.0,25.0,18.0,0.0,0.0,0.0,0:00,0.0,174.0,10.0,10.0,73.0,5.0,7.0,1.0,0.0,0.0,0:00,1.0
19.01.2018,UFC 220: Miocic vs. Ngannou,19.01.2018,96849,96857,2018-01-19,22:00,Final,Volkan Oezdemir,84510,Daniel Cormier,85202,False,True,KO,2,2:00,Punches,,,,63.0,15.0,4.0,23.0,11.0,4.0,0.0,0.0,0.0,0:00,0.0,59.0,1.0,1.0,30.0,1.0,1.0,3.0,2.0,1.0,0:00,0.0
19.01.2018,UFC 220: Miocic vs. Ngannou,19.01.2018,96849,96856,2018-01-19,22:00,Final,Francis Ngannou,84393,Stipe Miocic,85201,False,True,Points,5,5:00,,,,"50-44, 50-44, 50-44",106.0,7.0,0.0,17.0,4.0,0.0,1.0,0.0,1.0,0:00,0.0,67.0,11.0,17.0,45.0,9.0,16.0,14.0,6.0,0.0,0:00,0.0
19.01.2018,UFC 220: Miocic vs. Ngannou,19.01.2018,96849,96852,2018-01-19,22:00,Final,Brandon Davis,84766,Kyle Bochniak,85584,False,True,Points,3,5:00,,,,"30-27, 29-28, 29-28",87.0,11.0,14.0,19.0,7.0,12.0,1.0,1.0,0.0,0:00,0.0,117.0,15.0,0.0,29.0,4.0,0.0,15.0,3.0,0.0,0:00,0.0
19.01.2018,UFC 220: Miocic vs. Ngannou,19.01.2018,96849,96854,2018-01-19,22:00,Final,Alexandre Pantoja,84648,Dustin Ortiz,84274,False,True,Points,3,5:00,,,,"29-28, 29-28, 29-28",41.0,5.0,3.0,13.0,4.0,2.0,1.0,1.0,2.0,0:00,0.0,59.0,10.0,11.0,19.0,8.0,9.0,12.0,7.0,0.0,0:00,0.0
19.01.2018,UFC 220: Miocic vs. Ngannou,19.01.2018,96849,96853,2018-01-19,22:00,Final,Abdul Razak Alhassan,87819,Sabah Homasi,96085,True,False,KO,1,3:47,Punch,,,,29.0,1.0,3.0,11.0,0.0,2.0,0.0,0.0,0.0,0:00,1.0,19.0,6.0,0.0,3.0,5.0,0.0,2.0,1.0,0.0,0:00,0.0
19.01.2018,UFC 220: Miocic vs. Ngannou,19.01.2018,96849,96851,2018-01-19,22:00,Final,Gleison Tibau,91224,Islam Makhachev,84786,False,True,KO,1,0:57,Punch,,,,2.0,1.0,1.0,1.0,0.0,1.0,0.0,0.0,0.0,0:00,0.0,5.0,1.0,0.0,2.0,1.0,0.0,0.0,0.0,0.0,0:00,1.0
19.01.2018,UFC 220: Miocic vs. Ngannou,19.01.2018,96849,96850,2018-01-19,22:00,Final,Enrique Barzola,84747,Matt Bessette,96491,True,False,Points,3,5:00,,,,"28-29, 28-29, 27-30",83.0,17.0,22.0,25.0,13.0,17.0,10.0,5.0,0.0,0:00,0.0,113.0,31.0,2.0,27.0,15.0,1.0,0.0,0.0,0.0,0:00,0.0
19.01.2018,UFC 220: Miocic vs. Ngannou,19.01.2018,96849,96855,2018-01-19,22:00,Final,Julio Arce,84947,Dan Ige,84617,True,False,Points,3,5:00,,,,"28-29, 27-30, 27-30",184.0,16.0,1.0,60.0,11.0,1.0,0.0,0.0,0.0,0:00,0.0,78.0,17.0,18.0,15.0,6.0,14.0,13.0,1.0,0.0,0:00,0.0
27.01.2018,UFC Fight Night: Jacare vs. Brunson 2,27.01.2018,96861,96869,2018-01-27,18:00,Final,Joaquim Silva,85322,Vinc Pichel,85036,False,True,Points,3,5:00,,,,"29-28, 29-28, 29-28",79.0,15.0,6.0,30.0,10.0,5.0,0.0,0.0,0.0,0:00,0.0,135.0,21.0,30.0,24.0,15.0,21.0,4.0,1.0,0.0,0:00,0.0
27.01.2018,UFC Fight Night: Jacare vs. Brunson 2,27.01.2018,96861,96873,2018-01-27,18:00,Final,Frank Camacho,84956,Drew Dober,84483,False,True,Points,3,5:00,,,,"30-27, 29-28, 29-28",194.0,29.0,0.0,80.0,26.0,0.0,3.0,3.0,0.0,0:00,0.0,262.0,45.0,15.0,96.0,34.0,15.0,6.0,0.0,0.0,0:00,0.0
27.01.2018,UFC Fight Night: Jacare vs. Brunson 2,27.01.2018,96861,96872,2018-01-27,18:00,Final,Gregor Gillespie,84288,Jordan Rinaldi,84611,True,False,KO,1,4:46,Punches,,,,51.0,2.0,2.0,31.0,1.0,2.0,2.0,1.0,0.0,0:00,0.0,14.0,1.0,1.0,5.0,1.0,1.0,0.0,0.0,0.0,0:00,0.0
27.01.2018,UFC Fight Night: Jacare vs. Brunson 2,27.01.2018,96861,96871,2018-01-27,18:00,Final,Andre Fili,84408,Dennis Bermudez,84279,True,False,S Dec,3,5:00,,,,,214.0,9.0,6.0,70.0,5.0,5.0,12.0,4.0,0.0,0:00,0.0,138.0,21.0,37.0,56.0,12.0,35.0,11.0,1.0,0.0,0:00,0.0
27.01.2018,UFC Fight Night: Jacare vs. Brunson 2,27.01.2018,96861,96870,2018-01-27,18:00,Final,Jacare Souza,84792,Derek Brunson,84706,True,False,KO,1,3:50,Kick,,,,10.0,11.0,0.0,7.0,2.0,0.0,1.0,0.0,0.0,0:00,1.0,28.0,4.0,2.0,5.0,2.0,1.0,0.0,0.0,0.0,0:00,0.0
27.01.2018,UFC Fight Night: Jacare vs. Brunson 2,27.01.2018,96861,96868,2018-01-27,18:00,Final,Ji Yeon Kim,85493,Justine Kish,86647,True,False,S Dec,3,5:00,,,,,201.0,11.0,3.0,60.0,5.0,3.0,0.0,0.0,0.0,0:00,0.0,132.0,31.0,40.0,43.0,22.0,31.0,0.0,0.0,0.0,0:00,0.0
27.01.2018,UFC Fight Night: Jacare vs. Brunson 2,27.01.2018,96861,96864,2018-01-27,18:00,Final,Erik Koch,85148,Bobby Green,85557,False,True,Points,3,5:00,,,,"29-28, 29-28, 29-28",129.0,10.0,7.0,45.0,7.0,4.0,1.0,1.0,0.0,0:00,0.0,116.0,56.0,22.0,48.0,43.0,19.0,5.0,1.0,0.0,0:00,0.0
27.01.2018,UFC Fight Night: Jacare vs. Brunson 2,27.01.2018,96861,96866,2018-01-27,18:00,Final,Katlyn Chookagian,84866,Mara Romero Borella,84297,True,False,Points,3,5:00,,,,"27-30, 28-29, 28-29",212.0,31.0,9.0,37.0,22.0,9.0,1.0,0.0,1.0,0:00,0.0,170.0,6.0,35.0,46.0,3.0,30.0,3.0,1.0,0.0,0:00,0.0
27.01.2018,UFC Fight Night: Jacare vs. Brunson 2,27.01.2018,96861,96865,2018-01-27,18:00,Final,Mirsad Bektic,85086,Godofredo Pepey,94022,True,False,KO,1,2:47,Punch,,,,24.0,4.0,5.0,7.0,1.0,4.0,0.0,0.0,0.0,0:00,1.0,12.0,4.0,1.0,2.0,2.0,1.0,0.0,0.0,0.0,0:00,0.0
27.01.2018,UFC Fight Night: Jacare vs. Brunson 2,27.01.2018,96861,96863,2018-01-27,18:00,Final,Cory Sandhagen,84285,Austin Arnett,84344,True,False,KO,2,3:48,Punches,,,,104.0,32.0,11.0,47.0,23.0,10.0,1.0,1.0,0.0,0:00,1.0,84.0,6.0,0.0,29.0,3.0,0.0,1.0,1.0,0.0,0:00,0.0
27.01.2018,UFC Fight Night: Jacare vs. Brunson 2,27.01.2018,96861,96862,2018-01-27,18:00,Final,Niko Price,84608,George Sullivan,94662,True,False,SUB,2,4:21,,,Rear Naked Choke,,34.0,9.0,4.0,13.0,7.0,4.0,5.0,2.0,3.0,0:00,0.0,53.0,4.0,4.0,15.0,3.0,3.0,6.0,1.0,0.0,0:00,0.0
27.01.2018,UFC Fight Night: Jacare vs. Brunson 2,27.01.2018,96861,96867,2018-01-27,18:00,Final,Juliana Lima,94979,Randa Markos,84538,False,True,Points,3,5:00,,,,"30-27, 30-27, 30-27",11.0,11.0,15.0,5.0,5.0,8.0,2.0,1.0,0.0,0:00,0.0,25.0,11.0,29.0,11.0,10.0,25.0,7.0,2.0,0.0,0:00,0.0
03.02.2018,UFC Fight Night: Machida vs. Anders,03.02.2018,96874,96886,2018-02-03,20:00,Final,Thiago Santos,84421,Anthony Smith,84592,True,False,KO,2,1:03,Kick,,,,56.0,21.0,5.0,33.0,20.0,5.0,1.0,0.0,0.0,0:00,2.0,22.0,0.0,0.0,10.0,0.0,0.0,3.0,1.0,0.0,0:00,0.0
03.02.2018,UFC Fight Night: Machida vs. Anders,03.02.2018,96874,96885,2018-02-03,20:00,Final,Marlon Vera,84443,Douglas Silva de Andrade,88444,False,True,Points,3,5:00,,,,"30-27, 30-27, 30-27",138.0,29.0,24.0,28.0,22.0,22.0,0.0,0.0,0.0,0:00,0.0,180.0,31.0,21.0,55.0,23.0,19.0,3.0,1.0,0.0,0:00,0.0
03.02.2018,UFC Fight Night: Machida vs. Anders,03.02.2018,96874,96884,2018-02-03,20:00,Final,Marcelo Golm,84662,Timothy Johnson,91400,False,True,Points,3,5:00,,,,"29-28, 29-28, 30-27",67.0,14.0,6.0,40.0,13.0,6.0,0.0,0.0,0.0,0:00,0.0,102.0,32.0,12.0,42.0,25.0,10.0,6.0,0.0,0.0,0:00,0.0
03.02.2018,UFC Fight Night: Machida vs. Anders,03.02.2018,96874,96883,2018-02-03,20:00,Final,Desmond Green,84632,Michel Prazeres,84414,False,True,Points,3,5:00,,,,"29-28, 29-28, 30-27",36.0,15.0,10.0,9.0,15.0,9.0,6.0,3.0,0.0,0:00,0.0,52.0,14.0,6.0,22.0,8.0,6.0,8.0,3.0,3.0,0:00,0.0
03.02.2018,UFC Fight Night: Machida vs. Anders,03.02.2018,96874,96882,2018-02-03,20:00,Final,Priscila Cachoeira,84520,Valentina Shevchenko,84859,False,True,SUB,2,4:25,,,Rear Naked Choke,,12.0,0.0,0.0,2.0,0.0,0.0,0.0,0.0,0.0,0:00,0.0,103.0,9.0,1.0,87.0,8.0,0.0,2.0,2.0,2.0,0:00,0.0
03.02.2018,UFC Fight Night: Machida vs. Anders,03.02.2018,96874,96881,2018-02-03,20:00,Final,Eryk Anders,84660,Lyoto Machida,92348,False,True,S Dec,5,5:00,,,,,63.0,13.0,1.0,18.0,13.0,1.0,11.0,3.0,0.0,0:00,0.0,57.0,31.0,24.0,18.0,23.0,21.0,0.0,0.0,0.0,0:00,0.0
03.02.2018,UFC Fight Night: Machida vs. Anders,03.02.2018,96874,96878,2018-02-03,20:00,Final,Polyana Viana,84589,Maia Stevenson,96879,True,False,SUB,1,3:50,,,Rear Naked Choke,,16.0,2.0,0.0,11.0,1.0,0.0,2.0,1.0,3.0,0:00,0.0,6.0,3.0,2.0,1.0,3.0,2.0,1.0,1.0,0.0,0:00,0.0
03.02.2018,UFC Fight Night: Machida vs. Anders,03.02.2018,96874,96877,2018-02-03,20:00,Final,Damir Hadzovic,84435,Alan Patrick,88136,False,True,Points,3,5:00,,,,"30-27, 30-27, 30-25",8.0,17.0,0.0,5.0,15.0,0.0,0.0,0.0,1.0,0:00,0.0,35.0,7.0,3.0,20.0,5.0,3.0,15.0,9.0,0.0,0:00,0.0
03.02.2018,UFC Fight Night: Machida vs. Anders,03.02.2018,96874,96876,2018-02-03,20:00,Final,Sergio Moraes,84486,Tim Means,84607,True,False,S Dec,3,5:00,,,,,168.0,22.0,2.0,70.0,15.0,2.0,1.0,0.0,0.0,0:00,0.0,229.0,28.0,17.0,91.0,22.0,16.0,0.0,0.0,0.0,0:00,1.0
03.02.2018,UFC Fight Night: Machida vs. Anders,03.02.2018,96874,96875,2018-02-03,20:00,Final,Joseph Morales,96562,Deiveson Figueiredo,84530,False,True,KO,2,4:34,Punches,,,,24.0,4.0,4.0,5.0,2.0,2.0,1.0,0.0,0.0,0:00,0.0,51.0,11.0,0.0,25.0,6.0,0.0,2.0,2.0,1.0,0:00,1.0
03.02.2018,UFC Fight Night: Machida vs. Anders,03.02.2018,96874,96880,2018-02-03,20:00,Final,Joe Soto,95024,Iuri Alcantara,93610,False,True,KO,1,1:06,Punches,,,,1.0,0.0,1.0,1.0,0.0,0.0,1.0,0.0,0.0,0:00,0.0,26.0,3.0,1.0,13.0,3.0,1.0,0.0,0.0,0.0,0:00,1.0
10.02.2018,UFC 221: Romero vs. Rockhold,10.02.2018,96887,96895,2018-02-10,11:30,Final,Yoel Romero,84793,Luke Rockhold,84934,True,False,KO,3,1:48,Punch,,,,60.0,17.0,15.0,23.0,10.0,12.0,0.0,0.0,0.0,0:00,1.0,87.0,15.0,17.0,22.0,10.0,13.0,0.0,0.0,0.0,0:00,0.0
10.02.2018,UFC 221: Romero vs. Rockhold,10.02.2018,96887,96899,2018-02-10,11:30,Final,Saparbeg Safarov,84523,Tyson Pedro,96235,False,True,SUB,1,3:54,,,Kimura,,20.0,1.0,1.0,6.0,1.0,1.0,5.0,2.0,0.0,0:00,0.0,17.0,2.0,4.0,6.0,2.0,4.0,1.0,0.0,1.0,0:00,0.0
10.02.2018,UFC 221: Romero vs. Rockhold,10.02.2018,96887,96898,2018-02-10,11:30,Final,Li Jingliang,85379,Jake Matthews,85497,False,True,Points,3,5:00,,,,"30-26, 30-26, 29-28",134.0,4.0,14.0,35.0,4.0,10.0,1.0,0.0,0.0,0:00,0.0,121.0,2.0,4.0,61.0,0.0,2.0,4.0,2.0,1.0,0:00,2.0
10.02.2018,UFC 221: Romero vs. Rockhold,10.02.2018,96887,96897,2018-02-10,11:30,Final,Cyril Asker,91385,Tai Tuivasa,84861,False,True,KO,1,2:18,Elbow,,,,10.0,1.0,0.0,2.0,1.0,0.0,0.0,0.0,0.0,0:00,0.0,43.0,8.0,0.0,30.0,8.0,0.0,0.0,0.0,0.0,0:00,0.0
10.02.2018,UFC 221: Romero vs. Rockhold,10.02.2018,96887,96894,2018-02-10,18:00,Final,Ben Nguyen,91475,Jussier Formiga,84529,False,True,SUB,3,1:43,,,Rear Naked Choke,,46.0,15.0,4.0,8.0,10.0,3.0,0.0,0.0,0.0,0:00,0.0,44.0,4.0,1.0,24.0,2.0,1.0,4.0,2.0,1.0,0:00,1.0
10.02.2018,UFC 221: Romero vs. Rockhold,10.02.2018,96887,96896,2018-02-10,11:30,Final,Curtis Blaydes,84535,Mark Hunt,93302,True,False,Points,3,5:00,,,,"27-29, 26-30, 26-30",95.0,6.0,4.0,46.0,6.0,4.0,14.0,10.0,0.0,0:00,0.0,31.0,0.0,1.0,13.0,0.0,1.0,0.0,0.0,0.0,0:00,1.0
10.02.2018,UFC 221: Romero vs. Rockhold,10.02.2018,96887,96892,2018-02-10,18:00,Final,Israel Adesanya,84359,Rob Wilkinson,96631,True,False,KO,2,3:37,Punches,,,,56.0,13.0,6.0,35.0,13.0,4.0,0.0,0.0,0.0,0:00,1.0,22.0,10.0,14.0,6.0,5.0,11.0,15.0,3.0,0.0,0:00,0.0
10.02.2018,UFC 221: Romero vs. Rockhold,10.02.2018,96887,96891,2018-02-10,18:00,Final,Dong Hyun Ma,84365,Damien Brown,95903,True,False,S Dec,3,5:00,,,,,114.0,19.0,20.0,43.0,7.0,17.0,0.0,0.0,0.0,0:00,0.0,81.0,19.0,23.0,16.0,12.0,18.0,0.0,0.0,0.0,0:00,0.0
10.02.2018,UFC 221: Romero vs. Rockhold,10.02.2018,96887,96893,2018-02-10,18:00,Final,Jeremy Kennedy,96089,Alexander Volkanovski,84829,False,True,KO,2,4:57,Punches,,,,24.0,1.0,0.0,7.0,1.0,0.0,3.0,0.0,0.0,0:00,0.0,103.0,10.0,7.0,57.0,10.0,6.0,3.0,2.0,0.0,0:00,0.0
10.02.2018,UFC 221: Romero vs. Rockhold,10.02.2018,96887,96890,2018-02-10,11:30,Final,Daichi Abe,96663,Luke Jumeau,85506,False,True,Points,3,5:00,,,,"28-27, 29-27, 29-28",144.0,14.0,13.0,43.0,7.0,13.0,1.0,0.0,0.0,0:00,0.0,93.0,20.0,17.0,35.0,11.0,17.0,1.0,1.0,0.0,0:00,0.0
10.02.2018,UFC 221: Romero vs. Rockhold,10.02.2018,96887,96889,2018-02-10,11:30,Final,Jose Quinonez,84614,Teruto Ishihara,84352,True,False,Points,3,5:00,,,,"28-29, 28-29, 27-30",59.0,8.0,31.0,16.0,6.0,27.0,7.0,2.0,0.0,0:00,0.0,77.0,12.0,20.0,8.0,6.0,19.0,4.0,1.0,0.0,0:00,1.0
10.02.2018,UFC 221: Romero vs. Rockhold,10.02.2018,96887,96888,2018-02-10,11:30,Final,Ross Pearson,84631,Mizuto Hirota,94293,True,False,Points,3,5:00,,,,"28-29, 27-30, 27-30",134.0,30.0,12.0,31.0,16.0,11.0,0.0,0.0,0.0,0:00,0.0,176.0,10.0,27.0,49.0,3.0,25.0,1.0,0.0,0.0,0:00,0.0
18.02.2018,UFC Fight Night: Cowboy vs. Medeiros,18.02.2018,96900,96913,2018-02-18,11:00,Final,Thibault Gouti,95880,Sage Northcutt,95669,False,True,Points,3,5:00,,,,"29-28, 29-28, 29-28",49.0,6.0,11.0,21.0,2.0,5.0,5.0,4.0,1.0,0:00,0.0,102.0,20.0,16.0,32.0,16.0,15.0,9.0,1.0,0.0,0:00,0.0
18.02.2018,UFC Fight Night: Cowboy vs. Medeiros,18.02.2018,96900,96912,2018-02-18,11:00,Final,Brandon Davis,84766,Steven Peterson,84740,True,False,Points,3,5:00,,,,"26-30, 28-29, 27-30",243.0,19.0,23.0,83.0,12.0,19.0,1.0,0.0,0.0,0:00,0.0,257.0,18.0,11.0,55.0,12.0,6.0,10.0,1.0,0.0,0:00,0.0
18.02.2018,UFC Fight Night: Cowboy vs. Medeiros,18.02.2018,96900,96911,2018-02-18,11:00,Final,Curtis Millender,84498,Thiago Alves,84300,True,False,KO,2,4:17,Knee,,,,85.0,10.0,11.0,31.0,7.0,9.0,0.0,0.0,0.0,0:00,2.0,63.0,3.0,40.0,3.0,3.0,27.0,1.0,1.0,0.0,0:00,0.0
18.02.2018,UFC Fight Night: Cowboy vs. Medeiros,18.02.2018,96900,96910,2018-02-18,11:00,Final,James Vick,84395,Francisco Trinaldo,84903,True,False,Points,3,5:00,,,,"28-29, 28-29, 28-29",100.0,50.0,8.0,24.0,38.0,6.0,2.0,1.0,0.0,0:00,1.0,67.0,20.0,3.0,10.0,16.0,0.0,3.0,3.0,1.0,0:00,0.0
18.02.2018,UFC Fight Night: Cowboy vs. Medeiros,18.02.2018,96900,96909,2018-02-18,11:00,Final,Marcin Tybura,84678,Derrick Lewis,84479,False,True,KO,3,2:48,Punch,,,,32.0,11.0,13.0,19.0,8.0,10.0,2.0,1.0,1.0,0:00,0.0,42.0,2.0,1.0,27.0,2.0,1.0,2.0,1.0,0.0,0:00,2.0
18.02.2018,UFC Fight Night: Cowboy vs. Medeiros,18.02.2018,96900,96908,2018-02-18,11:00,Final,Yancy Medeiros,84272,Donald Cerrone,84260,False,True,KO,1,4:58,Punch,,,,70.0,9.0,0.0,17.0,8.0,0.0,0.0,0.0,0.0,0:00,0.0,45.0,11.0,1.0,16.0,11.0,1.0,1.0,0.0,0.0,0:00,3.0
18.02.2018,UFC Fight Night: Cowboy vs. Medeiros,18.02.2018,96900,96907,2018-02-18,11:00,Final,Lucie Pudilova,84424,Sarah Moras,84703,True,False,Points,3,5:00,,,,"27-29, 28-29, 28-29",128.0,3.0,3.0,70.0,3.0,2.0,0.0,0.0,0.0,0:00,2.0,108.0,10.0,3.0,33.0,8.0,2.0,5.0,2.0,2.0,0:00,0.0
18.02.2018,UFC Fight Night: Cowboy vs. Medeiros,18.02.2018,96900,96906,2018-02-18,11:00,Final,Roberto Sanchez,96563,Joby Sanchez,95003,True,False,SUB,1,1:50,,,Rear Naked Choke,,2.0,0.0,1.0,1.0,0.0,1.0,3.0,3.0,1.0,0:00,0.0,5.0,0.0,0.0,1.0,0.0,0.0,0.0,0.0,0.0,0:00,0.0
18.02.2018,UFC Fight Night: Cowboy vs. Medeiros,18.02.2018,96900,96905,2018-02-18,11:00,Final,Brian Camozzi,96254,Geoff Neal,84256,False,True,SUB,1,2:48,,,Rear Naked Choke,,22.0,5.0,2.0,3.0,2.0,2.0,0.0,0.0,0.0,0:00,0.0,28.0,1.0,2.0,11.0,1.0,2.0,0.0,0.0,1.0,0:00,0.0
18.02.2018,UFC Fight Night: Cowboy vs. Medeiros,18.02.2018,96900,96904,2018-02-18,11:00,Final,Jared Gordon,85028,Diego Ferreira,84583,False,True,KO,1,1:58,Punch,,,,17.0,0.0,0.0,8.0,0.0,0.0,1.0,0.0,0.0,0:00,0.0,54.0,4.0,2.0,24.0,3.0,2.0,0.0,0.0,0.0,0:00,1.0
18.02.2018,UFC Fight Night: Cowboy vs. Medeiros,18.02.2018,96900,96902,2018-02-18,11:00,Final,Oskar Piechota,85335,Tim Williams,96903,True,False,KO,1,1:54,Punch,,,,18.0,2.0,2.0,13.0,2.0,2.0,0.0,0.0,0.0,0:00,1.0,12.0,0.0,6.0,4.0,0.0,4.0,0.0,0.0,0.0,0:00,0.0
18.02.2018,UFC Fight Night: Cowboy vs. Medeiros,18.02.2018,96900,96901,2018-02-18,11:00,Final,Alex Morono,84601,Joshua Burkman,91455,True,False,SUB,1,2:12,,,Guillotine Choke,,12.0,0.0,7.0,2.0,0.0,5.0,0.0,0.0,1.0,0:00,1.0,5.0,3.0,5.0,0.0,0.0,4.0,0.0,0.0,0.0,0:00,0.0
24.02.2018,UFC Fight Night: Emmett vs. Stephens,24.02.2018,96914,96925,2018-02-24,09:00,Final,Ilir Latifi,84910,Ovince Saint Preux,84455,True,False,SUB,1,3:48,,,Guillotine Choke,,25.0,6.0,10.0,11.0,5.0,9.0,0.0,0.0,1.0,0:00,1.0,18.0,3.0,3.0,2.0,2.0,3.0,0.0,0.0,0.0,0:00,0.0
24.02.2018,UFC Fight Night: Emmett vs. Stephens,24.02.2018,96914,96926,2018-02-24,09:00,Final,Mike Perry,84797,Max Griffin,84301,False,True,Points,3,5:00,,,,"30-27, 29-27, 29-27",77.0,18.0,15.0,23.0,8.0,14.0,4.0,1.0,0.0,0:00,0.0,138.0,15.0,15.0,58.0,7.0,13.0,1.0,0.0,0.0,0:00,1.0
24.02.2018,UFC Fight Night: Emmett vs. Stephens,24.02.2018,96914,96923,2018-02-24,09:00,Final,Josh Emmett,84744,Jeremy Stephens,84466,False,True,KO,2,1:35,Punch,,,,30.0,6.0,4.0,9.0,5.0,4.0,0.0,0.0,0.0,0:00,1.0,46.0,8.0,3.0,18.0,4.0,2.0,0.0,0.0,0.0,0:00,1.0
24.02.2018,UFC Fight Night: Emmett vs. Stephens,24.02.2018,96914,96922,2018-02-24,09:00,Final,Alan Jouban,84772,Ben Saunders,84884,True,False,KO,2,2:38,Punch,,,,109.0,13.0,19.0,53.0,10.0,15.0,0.0,0.0,0.0,0:00,2.0,60.0,14.0,5.0,21.0,8.0,4.0,0.0,0.0,0.0,0:00,0.0
24.02.2018,UFC Fight Night: Emmett vs. Stephens,24.02.2018,96914,96921,2018-02-24,09:00,Final,Maryna Moroz,84558,Angela Hill,84539,False,True,Points,3,5:00,,,,"30-27, 30-27, 30-27",241.0,62.0,18.0,39.0,32.0,13.0,2.0,0.0,0.0,0:00,0.0,144.0,37.0,28.0,63.0,26.0,25.0,2.0,1.0,0.0,0:00,0.0
24.02.2018,UFC Fight Night: Emmett vs. Stephens,24.02.2018,96914,96924,2018-02-24,09:00,Final,Tecia Torres,84469,Jessica Andrade,84826,False,True,Points,3,5:00,,,,"29-28, 29-28, 29-27",132.0,9.0,9.0,54.0,6.0,9.0,2.0,2.0,0.0,0:00,0.0,124.0,50.0,4.0,46.0,43.0,3.0,12.0,10.0,0.0,0:00,0.0
24.02.2018,UFC Fight Night: Emmett vs. Stephens,24.02.2018,96914,96919,2018-02-24,09:00,Final,Renan Barao,84374,Brian Kelleher,84696,False,True,Points,3,5:00,,,,"29-28, 30-27, 30-27",167.0,43.0,18.0,78.0,27.0,11.0,2.0,0.0,0.0,0:00,0.0,175.0,21.0,7.0,74.0,13.0,7.0,4.0,1.0,0.0,0:00,0.0
24.02.2018,UFC Fight Night: Emmett vs. Stephens,24.02.2018,96914,96918,2018-02-24,09:00,Final,Manny Bermudez,84383,Albert Morales,91723,True,False,SUB,2,2:33,,,Guillotine Choke,,28.0,0.0,0.0,12.0,0.0,0.0,5.0,1.0,3.0,0:00,0.0,50.0,2.0,2.0,16.0,1.0,2.0,1.0,1.0,0.0,0:00,0.0
24.02.2018,UFC Fight Night: Emmett vs. Stephens,24.02.2018,96914,96917,2018-02-24,09:00,Final,Alex Perez,84755,Eric Shelton,84738,True,False,Points,3,5:00,,,,"27-30, 27-30, 27-30",64.0,6.0,12.0,15.0,3.0,11.0,9.0,5.0,0.0,0:00,0.0,98.0,9.0,2.0,30.0,9.0,2.0,2.0,0.0,0.0,0:00,0.0
24.02.2018,UFC Fight Night: Emmett vs. Stephens,24.02.2018,96914,96916,2018-02-24,09:00,Final,Russell Doane,91318,Rani Yahya,84361,False,True,SUB,3,2:32,,,Arm Triangle,,5.0,3.0,0.0,0.0,2.0,0.0,1.0,1.0,0.0,0:00,0.0,4.0,14.0,2.0,1.0,14.0,2.0,3.0,2.0,2.0,0:00,0.0
24.02.2018,UFC Fight Night: Emmett vs. Stephens,24.02.2018,96914,96915,2018-02-24,09:00,Final,Marcin Prachnio,88004,Sam Alvey,84368,False,True,KO,1,4:23,Punch,,,,10.0,6.0,8.0,3.0,4.0,8.0,0.0,0.0,0.0,0:00,0.0,12.0,1.0,6.0,3.0,1.0,6.0,1.0,1.0,0.0,0:00,2.0
24.02.2018,UFC Fight Night: Emmett vs. Stephens,24.02.2018,96914,96920,2018-02-24,09:00,Final,Marion Reneau,84494,Sara McMann,85071,True,False,SUB,2,3:40,,,Triangle Choke,,38.0,1.0,0.0,23.0,0.0,0.0,0.0,0.0,1.0,0:00,0.0,42.0,5.0,2.0,5.0,2.0,2.0,5.0,2.0,0.0,0:00,0.0
02.03.2018,UFC 222: Cyborg vs. Kunitskaya,02.03.2018,96927,96939,2018-03-02,22:00,Final,Ketlen Vieira,85617,Cat Zingano,91501,True,False,S Dec,3,5:00,,,,,60.0,8.0,3.0,32.0,6.0,3.0,2.0,2.0,1.0,0:00,0.0,70.0,25.0,11.0,33.0,17.0,9.0,2.0,0.0,0.0,0:00,0.0
02.03.2018,UFC 222: Cyborg vs. Kunitskaya,02.03.2018,96927,96938,2018-03-02,22:00,Final,Andrei Arlovski,84694,Stefan Struve,84426,True,False,Points,3,5:00,,,,"27-30, 28-29, 28-29",42.0,26.0,20.0,12.0,16.0,18.0,9.0,4.0,0.0,0:00,0.0,40.0,16.0,18.0,9.0,8.0,17.0,3.0,0.0,0.0,0:00,0.0
02.03.2018,UFC 222: Cyborg vs. Kunitskaya,02.03.2018,96927,96936,2018-03-02,22:00,Final,Brian Ortega,88111,Frankie Edgar,85156,True,False,KO,1,4:44,Punch,,,,71.0,4.0,1.0,21.0,3.0,1.0,0.0,0.0,0.0,0:00,1.0,59.0,13.0,5.0,12.0,10.0,5.0,1.0,0.0,0.0,0:00,0.0
02.03.2018,UFC 222: Cyborg vs. Kunitskaya,02.03.2018,96927,96935,2018-03-02,22:00,Final,Yana Kunitskaya,84495,Cris Cyborg,85158,False,True,KO,1,3:25,Punches,,,,4.0,5.0,2.0,2.0,1.0,2.0,4.0,1.0,0.0,0:00,0.0,31.0,12.0,0.0,22.0,11.0,0.0,1.0,1.0,0.0,0:00,0.0
02.03.2018,UFC 222: Cyborg vs. Kunitskaya,02.03.2018,96927,96934,2018-03-02,22:00,Final,Hector Lombard,91665,CB Dollaway,91254,False,True,DQ,1,5:00,,,,,18.0,4.0,11.0,8.0,2.0,9.0,0.0,0.0,0.0,0:00,1.0,7.0,11.0,1.0,4.0,8.0,1.0,0.0,0.0,0.0,0:00,0.0
02.03.2018,UFC 222: Cyborg vs. Kunitskaya,02.03.2018,96927,96937,2018-03-02,22:00,Final,Andre Soukhamthath,84651,Sean O'Malley,85045,False,True,Points,3,5:00,,,,"29-28, 29-27, 29-27",37.0,12.0,11.0,7.0,9.0,9.0,7.0,4.0,0.0,0:00,0.0,83.0,21.0,7.0,41.0,15.0,7.0,0.0,0.0,3.0,0:00,0.0
02.03.2018,UFC 222: Cyborg vs. Kunitskaya,02.03.2018,96927,96932,2018-03-02,22:00,Final,Alexander Hernandez,84282,Beneil Dariush,84482,True,False,KO,1,0:42,Punch,,,,10.0,3.0,0.0,5.0,3.0,0.0,0.0,0.0,0.0,0:00,1.0,7.0,3.0,1.0,2.0,1.0,1.0,0.0,0.0,0.0,0:00,0.0
02.03.2018,UFC 222: Cyborg vs. Kunitskaya,02.03.2018,96927,96931,2018-03-02,22:00,Final,Mackenzie Dern,85522,Ashley Yoder,84873,True,False,S Dec,3,5:00,,,,,111.0,15.0,17.0,39.0,14.0,17.0,6.0,1.0,1.0,0:00,0.0,109.0,23.0,10.0,27.0,17.0,8.0,0.0,0.0,0.0,0:00,1.0
02.03.2018,UFC 222: Cyborg vs. Kunitskaya,02.03.2018,96927,96930,2018-03-02,22:00,Final,Adam Milstead,91437,Jordan Johnson,96311,False,True,S Dec,3,5:00,,,,,121.0,7.0,5.0,47.0,6.0,5.0,0.0,0.0,0.0,0:00,0.0,88.0,9.0,9.0,44.0,7.0,8.0,11.0,2.0,0.0,0:00,0.0
02.03.2018,UFC 222: Cyborg vs. Kunitskaya,02.03.2018,96927,96929,2018-03-02,22:00,Final,Cody Stamann,84642,Bryan Caraway,91435,True,False,S Dec,3,5:00,,,,,132.0,26.0,8.0,67.0,21.0,7.0,1.0,0.0,0.0,0:00,0.0,156.0,7.0,5.0,50.0,4.0,5.0,23.0,1.0,0.0,0:00,0.0
02.03.2018,UFC 222: Cyborg vs. Kunitskaya,02.03.2018,96927,96928,2018-03-02,22:00,Final,Zak Ottow,84602,Mike Pyle,92923,True,False,KO,1,2:34,Punches,,,,40.0,8.0,2.0,18.0,2.0,2.0,0.0,0.0,0.0,0:00,1.0,15.0,5.0,0.0,1.0,3.0,0.0,0.0,0.0,0.0,0:00,0.0
02.03.2018,UFC 222: Cyborg vs. Kunitskaya,02.03.2018,96927,96933,2018-03-02,22:00,Final,Pedro Munhoz,84458,John Dodson,84432,False,True,S Dec,3,5:00,,,,,118.0,39.0,15.0,39.0,21.0,9.0,1.0,1.0,0.0,0:00,0.0,151.0,26.0,7.0,47.0,22.0,7.0,0.0,0.0,0.0,0:00,0.0
17.03.2018,UFC Fight Night: Werdum vs. Volkov,17.03.2018,96940,96951,2018-03-17,14:00,Final,Leon Edwards,84507,Peter Sobotta,87844,True,False,KO,3,4:59,Punch,,,,78.0,6.0,2.0,37.0,5.0,0.0,2.0,1.0,0.0,0:00,1.0,34.0,4.0,5.0,8.0,3.0,5.0,4.0,1.0,0.0,0:00,0.0
17.03.2018,UFC Fight Night: Werdum vs. Volkov,17.03.2018,96940,96950,2018-03-17,14:00,Final,Tom Duquesnoy,96391,Terrion Ware,96477,True,False,Points,3,5:00,,,,"27-30, 28-29, 28-29",104.0,18.0,31.0,28.0,8.0,31.0,3.0,0.0,0.0,0:00,0.0,234.0,21.0,12.0,60.0,15.0,10.0,6.0,2.0,0.0,0:00,0.0
17.03.2018,UFC Fight Night: Werdum vs. Volkov,17.03.2018,96940,96949,2018-03-17,14:00,Final,Jimi Manuwa,84908,Jan Blachowicz,84420,False,True,Points,3,5:00,,,,"30-27, 29-28, 29-28",79.0,23.0,8.0,16.0,17.0,4.0,2.0,0.0,0.0,0:00,0.0,171.0,15.0,5.0,81.0,11.0,5.0,6.0,1.0,0.0,0:00,1.0
17.03.2018,UFC Fight Night: Werdum vs. Volkov,17.03.2018,96940,96948,2018-03-17,14:00,Final,Alexander Volkov,84675,Fabricio Werdum,87652,True,False,KO,4,1:38,Punch,,,,75.0,11.0,4.0,37.0,8.0,3.0,2.0,2.0,0.0,0:00,1.0,66.0,14.0,8.0,30.0,12.0,6.0,9.0,3.0,0.0,0:00,0.0
17.03.2018,UFC Fight Night: Werdum vs. Volkov,17.03.2018,96940,96946,2018-03-17,14:00,Final,Dmitry Sosnovskiy,96947,Mark Godbeer,96211,True,False,SUB,2,4:29,,,Rear Naked Choke,,32.0,7.0,1.0,22.0,5.0,1.0,3.0,2.0,2.0,0:00,0.0,24.0,12.0,1.0,11.0,12.0,1.0,1.0,0.0,0.0,0:00,0.0
17.03.2018,UFC Fight Night: Werdum vs. Volkov,17.03.2018,96940,96944,2018-03-17,14:00,Final,Magomed Ankalaev,84411,Paul Craig,84546,False,True,SUB,3,4:59,,,Triangle Choke,,70.0,21.0,5.0,36.0,19.0,4.0,0.0,0.0,0.0,0:00,0.0,30.0,14.0,6.0,2.0,10.0,6.0,7.0,2.0,1.0,0:00,0.0
17.03.2018,UFC Fight Night: Werdum vs. Volkov,17.03.2018,96940,96943,2018-03-17,14:00,Final,Danny Henry,84616,Hakeem Dawodu,85309,True,False,SUB,1,0:39,,,Guillotine Choke,,4.0,1.0,0.0,2.0,0.0,0.0,0.0,0.0,1.0,0:00,1.0,1.0,0.0,2.0,1.0,0.0,2.0,0.0,0.0,0.0,0:00,0.0
17.03.2018,UFC Fight Night: Werdum vs. Volkov,17.03.2018,96940,96942,2018-03-17,14:00,Final,Oliver Enkamp,91699,Danny Roberts,84516,False,True,KO,1,2:12,Punch,,,,4.0,1.0,7.0,1.0,1.0,5.0,1.0,0.0,0.0,0:00,0.0,8.0,1.0,1.0,2.0,1.0,1.0,0.0,0.0,0.0,0:00,1.0
17.03.2018,UFC Fight Night: Werdum vs. Volkov,17.03.2018,96940,96941,2018-03-17,14:00,Final,Charles Byrd,84440,John Phillips,84514,True,False,SUB,1,3:58,,,Rear Naked Choke,,14.0,0.0,0.0,11.0,0.0,0.0,1.0,1.0,1.0,0:00,0.0,1.0,0.0,0.0,0.0,0.0,0.0,0.0,0.0,0.0,0:00,0.0
17.03.2018,UFC Fight Night: Werdum vs. Volkov,17.03.2018,96940,96945,2018-03-17,14:00,Final,Stevie Ray,84913,Kajan Johnson,94902,False,True,S Dec,3,5:00,,,,,52.0,3.0,7.0,18.0,1.0,5.0,4.0,3.0,1.0,0:00,0.0,22.0,16.0,16.0,7.0,13.0,13.0,4.0,2.0,0.0,0:00,0.0
07.04.2018,UFC 223: Khabib vs. Iaquinta,07.04.2018,96952,96958,2018-04-07,13:00,Final,Joanna Jedrzejczyk,85518,Rose Namajunas,84827,False,True,Points,5,5:00,,,,"49-46, 49-46, 49-46",257.0,37.0,62.0,64.0,27.0,54.0,0.0,0.0,0.0,0:00,0.0,270.0,24.0,7.0,85.0,15.0,5.0,2.0,1.0,0.0,0:00,0.0
07.04.2018,UFC 223: Khabib vs. Iaquinta,07.04.2018,96952,96960,2018-04-07,13:00,Final,Zabit Magomedsharipov,84467,Kyle Bochniak,85584,True,False,Points,3,5:00,,,,"27-30, 27-30, 28-29",188.0,14.0,15.0,75.0,11.0,11.0,11.0,5.0,0.0,0:00,0.0,149.0,13.0,1.0,34.0,9.0,0.0,2.0,0.0,0.0,0:00,0.0
07.04.2018,UFC 223: Khabib vs. Iaquinta,07.04.2018,96952,96959,2018-04-07,13:00,Final,Calvin Kattar,84921,Renato Moicano,84319,False,True,Points,3,5:00,,,,"30-27, 30-27, 29-28",131.0,8.0,1.0,35.0,5.0,1.0,2.0,0.0,0.0,0:00,0.0,133.0,27.0,46.0,60.0,18.0,38.0,0.0,0.0,0.0,0:00,0.0
07.04.2018,UFC 223: Khabib vs. Iaquinta,07.04.2018,96952,96957,2018-04-07,13:00,Final,Al Iaquinta,84809,Khabib Nurmagomedov,85226,False,True,Points,5,5:00,,,,"50-43, 50-44, 50-43",117.0,20.0,4.0,27.0,11.0,3.0,1.0,0.0,0.0,0:00,0.0,287.0,12.0,5.0,122.0,7.0,5.0,15.0,6.0,1.0,0:00,0.0
07.04.2018,UFC 223: Khabib vs. Iaquinta,07.04.2018,96952,96961,2018-04-07,13:00,Final,Chris Gruetzemacher,84732,Joe Lauzon,85526,True,False,KO,2,5:00,,,,,135.0,50.0,11.0,72.0,45.0,11.0,0.0,0.0,0.0,0:00,0.0,125.0,10.0,2.0,40.0,7.0,1.0,2.0,0.0,0.0,0:00,0.0
07.04.2018,UFC 223: Khabib vs. Iaquinta,07.04.2018,96952,96955,2018-04-07,13:00,Final,Ashlee Evans-Smith,84386,Bec Rawlings,95195,True,False,Points,3,5:00,,,,"27-30, 27-30, 27-30",276.0,36.0,19.0,81.0,20.0,15.0,4.0,1.0,0.0,0:00,0.0,147.0,18.0,30.0,46.0,14.0,28.0,0.0,0.0,0.0,0:00,0.0
07.04.2018,UFC 223: Khabib vs. Iaquinta,07.04.2018,96952,96954,2018-04-07,13:00,Final,Olivier Aubin-Mercier,85152,Evan Dunham,87725,True,False,KO,1,0:53,Knees,,,,14.0,4.0,0.0,9.0,4.0,0.0,0.0,0.0,0.0,0:00,1.0,14.0,0.0,0.0,4.0,0.0,0.0,0.0,0.0,0.0,0:00,0.0
07.04.2018,UFC 223: Khabib vs. Iaquinta,07.04.2018,96952,96953,2018-04-07,13:00,Final,Karolina Kowalkiewicz,84554,Felice Herrig,84856,True,False,S Dec,3,5:00,,,,,191.0,42.0,15.0,82.0,31.0,13.0,3.0,0.0,0.0,0:00,0.0,181.0,25.0,10.0,62.0,19.0,5.0,5.0,0.0,0.0,0:00,0.0
07.04.2018,UFC 223: Khabib vs. Iaquinta,07.04.2018,96952,96956,2018-04-07,13:00,Final,Mike Rodriguez,85067,Devin Clark,84788,False,True,Points,3,5:00,,,,"30-27, 30-27, 29-28",39.0,23.0,4.0,17.0,21.0,2.0,0.0,0.0,0.0,0:00,0.0,38.0,16.0,10.0,30.0,12.0,8.0,11.0,7.0,0.0,0:00,0.0
14.04.2018,UFC Fight Night: Poirier vs. Gaethje,14.04.2018,96962,96976,2018-04-14,17:00,Final,Israel Adesanya,84359,Marvin Vettori,85091,True,False,S Dec,3,5:00,,,,,92.0,12.0,19.0,31.0,11.0,15.0,1.0,0.0,0.0,0:00,0.0,122.0,8.0,24.0,20.0,7.0,19.0,6.0,2.0,0.0,0:00,0.0
14.04.2018,UFC Fight Night: Poirier vs. Gaethje,14.04.2018,96962,96975,2018-04-14,17:00,Final,Alex Oliveira,84798,Carlos Condit,85568,True,False,SUB,2,3:17,,,Guillotine Choke,,22.0,1.0,0.0,8.0,1.0,0.0,3.0,3.0,1.0,0:00,0.0,12.0,2.0,4.0,6.0,2.0,4.0,1.0,1.0,1.0,0:00,0.0
14.04.2018,UFC Fight Night: Poirier vs. Gaethje,14.04.2018,96962,96974,2018-04-14,17:00,Final,Justin Gaethje,84552,Dustin Poirier,84656,False,True,KO,4,0:33,Punch,,,,143.0,12.0,57.0,56.0,9.0,50.0,0.0,0.0,0.0,0:00,0.0,314.0,26.0,11.0,142.0,21.0,11.0,5.0,0.0,0.0,0:00,0.0
14.04.2018,UFC Fight Night: Poirier vs. Gaethje,14.04.2018,96962,96973,2018-04-14,17:00,Final,Krzysztof Jotko,84665,Brad Tavares,85598,False,True,KO,3,2:16,Punch,,,,62.0,6.0,6.0,18.0,3.0,3.0,3.0,0.0,0.0,0:00,0.0,64.0,15.0,17.0,23.0,6.0,17.0,1.0,0.0,0.0,0:00,1.0
14.04.2018,UFC Fight Night: Poirier vs. Gaethje,14.04.2018,96962,96972,2018-04-14,17:00,Final,John Moraga,91353,Wilson Reis,84649,True,False,Points,3,5:00,,,,"28-29, 28-29, 28-29",73.0,14.0,4.0,30.0,12.0,4.0,0.0,0.0,1.0,0:00,0.0,52.0,4.0,5.0,6.0,1.0,5.0,16.0,8.0,0.0,0:00,0.0
14.04.2018,UFC Fight Night: Poirier vs. Gaethje,14.04.2018,96962,96970,2018-04-14,17:00,Final,Muslim Salikhov,85385,Ricky Rainey,96971,True,False,KO,2,4:12,Punch,,,,32.0,8.0,8.0,10.0,8.0,7.0,2.0,0.0,0.0,0:00,1.0,26.0,7.0,11.0,6.0,6.0,7.0,1.0,0.0,0.0,0:00,0.0
14.04.2018,UFC Fight Night: Poirier vs. Gaethje,14.04.2018,96962,96977,2018-04-14,17:00,Final,Cortney Casey,84398,Michelle Waterson,84555,False,True,S Dec,3,5:00,,,,,79.0,8.0,9.0,22.0,7.0,7.0,1.0,0.0,3.0,0:00,0.0,49.0,15.0,20.0,30.0,13.0,18.0,4.0,3.0,0.0,0:00,0.0
14.04.2018,UFC Fight Night: Poirier vs. Gaethje,14.04.2018,96962,96968,2018-04-14,17:00,Final,Patrick Williams,94822,Luke Sanders,84375,False,True,Points,3,5:00,,,,"29-28, 30-27, 30-27",56.0,20.0,33.0,15.0,15.0,31.0,5.0,1.0,0.0,0:00,0.0,121.0,16.0,3.0,44.0,13.0,2.0,0.0,0.0,0.0,0:00,1.0
14.04.2018,UFC Fight Night: Poirier vs. Gaethje,14.04.2018,96962,96967,2018-04-14,17:00,Final,Matthew Lopez,91458,Alejandro Perez,84445,False,True,KO,2,3:42,Punches,,,,28.0,7.0,1.0,14.0,7.0,1.0,7.0,3.0,2.0,0:00,0.0,79.0,8.0,13.0,27.0,8.0,9.0,1.0,0.0,0.0,0:00,0.0
14.04.2018,UFC Fight Night: Poirier vs. Gaethje,14.04.2018,96962,96966,2018-04-14,17:00,Final,Arjan Bhullar,84709,Adam Wieczorek,96738,False,True,SUB,2,1:59,,,Omo Plata,,18.0,0.0,0.0,9.0,0.0,0.0,3.0,2.0,0.0,0:00,0.0,14.0,6.0,7.0,2.0,4.0,7.0,0.0,0.0,1.0,0:00,0.0
14.04.2018,UFC Fight Night: Poirier vs. Gaethje,14.04.2018,96962,96965,2018-04-14,17:00,Final,Yushin Okami,92232,Dhiego Lima,84681,True,False,Points,3,5:00,,,,"26-30, 26-30, 26-30",18.0,0.0,1.0,14.0,0.0,1.0,13.0,6.0,0.0,0:00,0.0,16.0,6.0,2.0,6.0,3.0,2.0,0.0,0.0,0.0,0:00,0.0
14.04.2018,UFC Fight Night: Poirier vs. Gaethje,14.04.2018,96962,96964,2018-04-14,17:00,Final,Shana Dobson,85196,Lauren Mueller,84763,False,True,Points,3,5:00,,,,"29-28, 29-28, 29-28",158.0,36.0,12.0,34.0,23.0,11.0,4.0,1.0,0.0,0:00,0.0,119.0,29.0,8.0,31.0,20.0,7.0,2.0,2.0,0.0,0:00,0.0
14.04.2018,UFC Fight Night: Poirier vs. Gaethje,14.04.2018,96962,96963,2018-04-14,17:00,Final,Dan Moret,84605,Gilbert Burns,84888,False,True,KO,2,0:59,Punch,,,,43.0,9.0,6.0,10.0,4.0,6.0,0.0,0.0,0.0,0:00,0.0,55.0,9.0,1.0,22.0,8.0,1.0,2.0,2.0,0.0,0:00,1.0
14.04.2018,UFC Fight Night: Poirier vs. Gaethje,14.04.2018,96962,96969,2018-04-14,17:00,Final,Antonio Carlos Junior,84840,Tim Boetsch,84491,True,False,SUB,1,4:28,,,Rear Naked Choke,,40.0,4.0,4.0,23.0,4.0,4.0,2.0,1.0,1.0,0:00,0.0,14.0,2.0,2.0,4.0,1.0,2.0,0.0,0.0,0.0,0:00,0.0
21.04.2018,UFC Fight Night: Barboza vs. Lee,21.04.2018,96978,97595,2018-04-21,19:00,Final,Dan Hooker,85116,Jim Miller,84685,True,False,KO,1,3:00,Knee,,,,33.0,4.0,7.0,15.0,4.0,5.0,0.0,0.0,0.0,0:00,1.0,16.0,2.0,2.0,6.0,2.0,2.0,2.0,1.0,0.0,0:00,0.0
21.04.2018,UFC Fight Night: Barboza vs. Lee,21.04.2018,96978,97594,2018-04-21,19:00,Final,Brett Johns,86651,Aljamain Sterling,84381,False,True,Points,3,5:00,,,,"30-27, 30-27, 30-27",79.0,8.0,2.0,23.0,4.0,0.0,5.0,1.0,0.0,0:00,0.0,88.0,51.0,13.0,40.0,37.0,12.0,9.0,3.0,0.0,0:00,0.0
21.04.2018,UFC Fight Night: Barboza vs. Lee,21.04.2018,96978,97593,2018-04-21,19:00,Final,Thiago Santos,84421,David Branch,84639,False,True,KO,1,2:30,Punch,,,,17.0,3.0,9.0,4.0,2.0,8.0,0.0,0.0,0.0,0:00,0.0,14.0,1.0,0.0,5.0,0.0,0.0,1.0,0.0,0.0,0:00,1.0
21.04.2018,UFC Fight Night: Barboza vs. Lee,21.04.2018,96978,97592,2018-04-21,19:00,Final,Justin Willis,84536,Chase Sherman,87685,True,False,Points,3,5:00,,,,"28-29, 28-29, 28-29",101.0,8.0,0.0,68.0,8.0,0.0,2.0,1.0,0.0,0:00,1.0,90.0,33.0,14.0,34.0,24.0,11.0,0.0,0.0,0.0,0:00,0.0
21.04.2018,UFC Fight Night: Barboza vs. Lee,21.04.2018,96978,97591,2018-04-21,19:00,Final,Cub Swanson,84812,Frankie Edgar,85156,False,True,Points,3,5:00,,,,"30-27, 30-27, 30-27",110.0,15.0,5.0,32.0,11.0,5.0,0.0,0.0,0.0,0:00,0.0,106.0,10.0,20.0,33.0,6.0,19.0,8.0,0.0,0.0,0:00,0.0
21.04.2018,UFC Fight Night: Barboza vs. Lee,21.04.2018,96978,97589,2018-04-21,19:00,Final,Corey Anderson,85543,Patrick Cummins,84848,True,False,Points,3,5:00,,,,"27-30, 26-30, 26-30",107.0,10.0,2.0,56.0,6.0,2.0,13.0,12.0,0.0,0:00,0.0,85.0,12.0,2.0,24.0,6.0,1.0,1.0,0.0,0.0,0:00,0.0
21.04.2018,UFC Fight Night: Barboza vs. Lee,21.04.2018,96978,97588,2018-04-21,19:00,Final,Luan Chagas,95943,Siyar Bahadurzada,84803,False,True,KO,2,2:40,Kick,,,,26.0,6.0,5.0,7.0,1.0,3.0,1.0,0.0,0.0,0:00,0.0,51.0,9.0,4.0,20.0,9.0,4.0,1.0,1.0,0.0,0:00,1.0
21.04.2018,UFC Fight Night: Barboza vs. Lee,21.04.2018,96978,96981,2018-04-21,19:00,Final,Merab Dvalishvili,84711,Ricky Simon,84362,False,True,KO,3,5:00,,,,,185.0,12.0,13.0,42.0,8.0,11.0,22.0,6.0,0.0,0:00,1.0,91.0,9.0,3.0,25.0,6.0,3.0,7.0,2.0,1.0,0:00,0.0
21.04.2018,UFC Fight Night: Barboza vs. Lee,21.04.2018,96978,96980,2018-04-21,19:00,Final,Alex Garcia,91718,Ryan LaFlare,94319,False,True,Points,3,5:00,,,,"30-27, 30-27, 30-27",46.0,7.0,1.0,6.0,4.0,1.0,7.0,5.0,0.0,0:00,0.0,27.0,19.0,2.0,5.0,17.0,2.0,6.0,1.0,0.0,0:00,0.0
21.04.2018,UFC Fight Night: Barboza vs. Lee,21.04.2018,96978,96979,2018-04-21,16:30,Final,Anthony Rocco Martin,84485,Keita Nakamura,84777,True,False,Points,3,5:00,,,,"27-30, 27-30, 27-30",124.0,6.0,3.0,48.0,5.0,3.0,0.0,0.0,2.0,0:00,0.0,70.0,9.0,4.0,16.0,6.0,2.0,5.0,2.0,0.0,0:00,0.0
21.04.2018,UFC Fight Night: Barboza vs. Lee,21.04.2018,96978,97590,2018-04-21,19:00,Final,Kevin Lee,84837,Edson Barboza,84551,True,False,TKO - Dr,5,2:18,,,,,236.0,4.0,1.0,138.0,3.0,1.0,9.0,4.0,0.0,0:00,0.0,73.0,26.0,7.0,26.0,20.0,5.0,1.0,0.0,0.0,0:00,0.0
12.05.2018,UFC 224: Nunes vs. Pennington,12.05.2018,96982,96991,2018-05-12,19:00,Final,Raquel Pennington,85124,Amanda Nunes,84879,False,True,KO,5,2:36,Punches,,,,148.0,15.0,6.0,49.0,10.0,5.0,8.0,1.0,0.0,0:00,0.0,171.0,46.0,37.0,72.0,31.0,21.0,4.0,3.0,0.0,0:00,0.0
12.05.2018,UFC 224: Nunes vs. Pennington,12.05.2018,96982,96995,2018-05-12,19:00,Final,Lyoto Machida,92348,Vitor Belfort,90802,True,False,KO,2,1:00,Kick,,,,8.0,11.0,3.0,2.0,7.0,2.0,0.0,0.0,0.0,0:00,1.0,11.0,1.0,0.0,2.0,0.0,0.0,0.0,0.0,0.0,0:00,0.0
12.05.2018,UFC 224: Nunes vs. Pennington,12.05.2018,96982,96994,2018-05-12,19:00,Final,John Lineker,84689,Brian Kelleher,84696,True,False,KO,3,3:43,Punch,,,,173.0,49.0,11.0,65.0,31.0,6.0,0.0,0.0,1.0,0:00,2.0,112.0,19.0,6.0,41.0,6.0,3.0,6.0,1.0,0.0,0:00,0.0
12.05.2018,UFC 224: Nunes vs. Pennington,12.05.2018,96982,96993,2018-05-12,19:00,Final,Mackenzie Dern,85522,Amanda Cooper,96009,True,False,SUB,1,2:27,,,Rear Naked Choke,,30.0,2.0,0.0,14.0,1.0,0.0,0.0,0.0,1.0,0:00,1.0,24.0,0.0,1.0,5.0,0.0,1.0,0.0,0.0,0.0,0:00,0.0
12.05.2018,UFC 224: Nunes vs. Pennington,12.05.2018,96982,96992,2018-05-12,19:00,Final,Kelvin Gastelum,84356,Jacare Souza,84792,True,False,S Dec,3,5:00,,,,,133.0,10.0,2.0,44.0,7.0,2.0,0.0,0.0,0.0,0:00,1.0,84.0,30.0,1.0,42.0,21.0,1.0,9.0,1.0,1.0,0:00,0.0
12.05.2018,UFC 224: Nunes vs. Pennington,12.05.2018,96982,96990,2018-05-12,19:00,Final,Sean Strickland,88263,Elizeu Zaleski dos Santos,84497,False,True,KO,1,3:40,Kick,,,,35.0,0.0,1.0,13.0,0.0,1.0,0.0,0.0,0.0,0:00,0.0,41.0,8.0,9.0,9.0,2.0,4.0,1.0,0.0,0.0,0:00,1.0
12.05.2018,UFC 224: Nunes vs. Pennington,12.05.2018,96982,96983,2018-05-12,19:00,Final,Warlley Alves,84893,Sultan Aliev,84778,True,False,TKO - Dr,2,5:00,,,,,20.0,19.0,11.0,7.0,12.0,10.0,1.0,0.0,0.0,0:00,0.0,24.0,4.0,0.0,10.0,2.0,0.0,3.0,1.0,0.0,0:00,0.0
12.05.2018,UFC 224: Nunes vs. Pennington,12.05.2018,96982,96988,2018-05-12,19:00,Final,Junior Albini,84303,Aleksei Oleinik,84815,False,True,SUB,1,1:45,,,Other - Choke,,11.0,3.0,1.0,7.0,2.0,1.0,1.0,1.0,0.0,0:00,0.0,12.0,3.0,2.0,6.0,2.0,2.0,3.0,0.0,1.0,0:00,0.0
12.05.2018,UFC 224: Nunes vs. Pennington,12.05.2018,96982,96987,2018-05-12,19:00,Final,Karl Roberson,84278,Cezar Ferreira,84502,False,True,SUB,1,4:45,,,Arm Triangle,,5.0,0.0,1.0,3.0,0.0,1.0,0.0,0.0,0.0,0:00,0.0,5.0,1.0,0.0,4.0,1.0,0.0,3.0,2.0,1.0,0:00,0.0
12.05.2018,UFC 224: Nunes vs. Pennington,12.05.2018,96982,96986,2018-05-12,19:00,Final,Markus Perez,84294,James Bochnovic,96479,True,False,SUB,1,4:28,,,Rear Naked Choke,,3.0,1.0,0.0,3.0,1.0,0.0,1.0,1.0,2.0,0:00,0.0,3.0,3.0,0.0,1.0,2.0,0.0,1.0,0.0,0.0,0:00,0.0
12.05.2018,UFC 224: Nunes vs. Pennington,12.05.2018,96982,96985,2018-05-12,19:00,Final,Alberto Mina,95997,Ramazan Emeev,84415,False,True,Points,3,5:00,,,,"30-27, 30-27, 30-27",65.0,11.0,6.0,5.0,3.0,4.0,5.0,1.0,0.0,0:00,0.0,67.0,14.0,3.0,28.0,8.0,3.0,6.0,3.0,0.0,0:00,0.0
12.05.2018,UFC 224: Nunes vs. Pennington,12.05.2018,96982,96984,2018-05-12,19:00,Final,Jack Hermansson,84638,Thales Leites,92288,True,False,KO,3,2:10,Punches,,,,43.0,6.0,7.0,25.0,4.0,6.0,3.0,3.0,1.0,0:00,0.0,11.0,1.0,5.0,5.0,1.0,5.0,9.0,3.0,3.0,0:00,0.0
12.05.2018,UFC 224: Nunes vs. Pennington,12.05.2018,96982,96989,2018-05-12,19:00,Final,Davi Ramos,84952,Nick Hein,84918,True,False,SUB,1,4:15,,,Rear Naked Choke,,9.0,3.0,0.0,5.0,1.0,0.0,1.0,1.0,1.0,0:00,0.0,6.0,0.0,0.0,1.0,0.0,0.0,0.0,0.0,0.0,0:00,0.0
19.05.2018,UFC Fight Night: Maia vs. Usman,19.05.2018,96996,97601,2018-05-19,11:30,Final,Chad Laprise,94801,Vicente Luque,84404,False,True,KO,1,4:16,Punch,,,,21.0,3.0,5.0,6.0,3.0,4.0,1.0,0.0,0.0,0:00,0.0,26.0,3.0,6.0,9.0,1.0,4.0,0.0,0.0,0.0,0:00,1.0
19.05.2018,UFC Fight Night: Maia vs. Usman,19.05.2018,96996,97600,2018-05-19,11:30,Final,Veronica Macedo,84576,Andrea Lee,84387,False,True,Points,3,5:00,,,,"30-27, 30-27, 30-27",60.0,7.0,6.0,17.0,3.0,4.0,1.0,1.0,1.0,0:00,0.0,37.0,29.0,27.0,17.0,24.0,15.0,5.0,3.0,2.0,0:00,0.0
19.05.2018,UFC Fight Night: Maia vs. Usman,19.05.2018,96996,97599,2018-05-19,11:30,Final,Diego Rivas,95130,Guido Cannetti,86719,False,True,Points,3,5:00,,,,"29-28, 29-28, 29-28",23.0,17.0,6.0,10.0,7.0,5.0,5.0,2.0,1.0,0:00,0.0,35.0,11.0,7.0,12.0,6.0,7.0,3.0,1.0,1.0,0:00,0.0
19.05.2018,UFC Fight Night: Maia vs. Usman,19.05.2018,96996,97598,2018-05-19,11:30,Final,Dominick Reyes,84511,Jared Cannonier,84718,True,False,KO,1,2:55,Punch,,,,33.0,11.0,8.0,7.0,5.0,8.0,1.0,0.0,0.0,0:00,1.0,18.0,1.0,2.0,4.0,0.0,2.0,0.0,0.0,0.0,0:00,0.0
19.05.2018,UFC Fight Night: Maia vs. Usman,19.05.2018,96996,97597,2018-05-19,11:30,Final,Tatiana Suarez,84864,Alexa Grasso,84548,True,False,SUB,1,2:44,,,Rear Naked Choke,,7.0,1.0,1.0,1.0,0.0,1.0,3.0,2.0,1.0,0:00,0.0,5.0,3.0,0.0,4.0,2.0,0.0,0.0,0.0,0.0,0:00,0.0
19.05.2018,UFC Fight Night: Maia vs. Usman,19.05.2018,96996,97596,2018-05-19,11:30,Final,Kamaru Usman,84460,Demian Maia,84322,True,False,Points,5,5:00,,,,"46-49, 46-49, 45-50",181.0,12.0,16.0,49.0,4.0,13.0,0.0,0.0,0.0,0:00,1.0,85.0,2.0,0.0,26.0,1.0,0.0,15.0,0.0,0.0,0:00,0.0
19.05.2018,UFC Fight Night: Maia vs. Usman,19.05.2018,96996,97002,2018-05-19,11:30,Final,Syuri Kondo,84872,Poliana Botelho,84762,False,True,KO,1,0:33,Kick,,,,1.0,0.0,2.0,0.0,0.0,2.0,0.0,0.0,0.0,0:00,0.0,10.0,2.0,1.0,7.0,1.0,1.0,0.0,0.0,0.0,0:00,1.0
19.05.2018,UFC Fight Night: Maia vs. Usman,19.05.2018,96996,97001,2018-05-19,11:30,Final,Brandon Moreno,85417,Alexandre Pantoja,84648,False,True,Points,3,5:00,,,,"29-27, 30-26, 30-26",113.0,5.0,15.0,32.0,4.0,9.0,7.0,2.0,0.0,0:00,0.0,133.0,17.0,18.0,58.0,7.0,14.0,0.0,0.0,0.0,0:00,0.0
19.05.2018,UFC Fight Night: Maia vs. Usman,19.05.2018,96996,97000,2018-05-19,11:30,Final,Michel Prazeres,84414,Zak Cummings,84845,True,False,S Dec,3,5:00,,,,,59.0,7.0,10.0,20.0,4.0,6.0,9.0,3.0,0.0,0:00,0.0,64.0,21.0,7.0,12.0,11.0,5.0,0.0,0.0,0.0,0:00,0.0
19.05.2018,UFC Fight Night: Maia vs. Usman,19.05.2018,96996,96999,2018-05-19,11:30,Final,Claudio Puelles,85413,Felipe Silva,96094,True,False,SUB,3,2:23,,,Kneebar,,41.0,6.0,2.0,11.0,3.0,2.0,7.0,2.0,1.0,0:00,0.0,101.0,17.0,12.0,48.0,12.0,10.0,1.0,1.0,0.0,0:00,1.0
19.05.2018,UFC Fight Night: Maia vs. Usman,19.05.2018,96996,96998,2018-05-19,11:30,Final,Frankie Saenz,84634,Henry Briones,95142,True,False,Points,3,5:00,,,,"26-30, 27-30, 27-30",81.0,22.0,17.0,36.0,18.0,12.0,10.0,4.0,0.0,0:00,1.0,82.0,13.0,9.0,25.0,10.0,9.0,0.0,0.0,1.0,0:00,0.0
19.05.2018,UFC Fight Night: Maia vs. Usman,19.05.2018,96996,96997,2018-05-19,11:30,Final,Brandon Davis,84766,Enrique Barzola,84747,False,True,Points,3,5:00,,,,"30-26, 30-26, 30-27",72.0,4.0,11.0,18.0,2.0,9.0,1.0,0.0,0.0,0:00,0.0,72.0,9.0,13.0,33.0,5.0,13.0,15.0,10.0,1.0,0:00,0.0
19.05.2018,UFC Fight Night: Maia vs. Usman,19.05.2018,96996,97003,2018-05-19,11:30,Final,Humberto Bandenay,85332,Gabriel Benitez,85198,False,True,KO,1,0:39,Slam,,,,1.0,0.0,1.0,1.0,0.0,1.0,0.0,0.0,1.0,0:00,0.0,17.0,1.0,1.0,7.0,1.0,1.0,1.0,1.0,0.0,0:00,1.0
27.05.2018,UFC Fight Night: Thompson vs. Till,27.05.2018,97004,97013,2018-05-27,03:30,Final,Mads Burnell,96622,Arnold Allen,84610,False,True,SUB,3,2:41,,,Other - Choke,,46.0,4.0,6.0,13.0,3.0,4.0,12.0,6.0,0.0,0:00,0.0,76.0,14.0,0.0,21.0,8.0,0.0,0.0,0.0,1.0,0:00,0.0
27.05.2018,UFC Fight Night: Thompson vs. Till,27.05.2018,97004,97015,2018-05-27,03:30,Final,Claudio Silva,84517,Nordine Taleb,84804,True,False,SUB,1,4:31,,,Rear Naked Choke,,27.0,9.0,3.0,11.0,6.0,1.0,3.0,1.0,1.0,0:00,0.0,6.0,4.0,2.0,1.0,3.0,2.0,2.0,1.0,0.0,0:00,0.0
27.05.2018,UFC Fight Night: Thompson vs. Till,27.05.2018,97004,97014,2018-05-27,03:30,Final,Jason Knight,95764,Makwan Amirkhani,84854,False,True,S Dec,3,5:00,,,,,52.0,18.0,18.0,10.0,6.0,13.0,1.0,0.0,1.0,0:00,2.0,60.0,1.0,1.0,25.0,1.0,1.0,5.0,3.0,0.0,0:00,0.0
27.05.2018,UFC Fight Night: Thompson vs. Till,27.05.2018,97004,97016,2018-05-27,03:30,Final,Darren Stewart,84869,Eric Spicely,84992,True,False,KO,2,1:47,Punch,,,,80.0,10.0,0.0,26.0,8.0,0.0,0.0,0.0,0.0,0:00,1.0,66.0,5.0,4.0,11.0,0.0,4.0,4.0,0.0,0.0,0:00,0.0
27.05.2018,UFC Fight Night: Thompson vs. Till,27.05.2018,97004,97011,2018-05-27,03:30,Final,Craig White,97012,Neil Magny,84905,False,True,KO,1,4:32,Knee,,,,10.0,2.0,5.0,1.0,2.0,3.0,2.0,0.0,0.0,0:00,0.0,22.0,6.0,1.0,14.0,3.0,1.0,2.0,0.0,0.0,0:00,1.0
27.05.2018,UFC Fight Night: Thompson vs. Till,27.05.2018,97004,97007,2018-05-27,03:30,Final,Gina Mazany,84451,Lina Lansberg,84914,False,True,Points,3,5:00,,,,"29-28, 30-27, 30-27",51.0,25.0,13.0,10.0,18.0,10.0,2.0,2.0,0.0,0:00,0.0,44.0,28.0,3.0,13.0,26.0,1.0,1.0,1.0,0.0,0:00,0.0
27.05.2018,UFC Fight Night: Thompson vs. Till,27.05.2018,97004,97009,2018-05-27,03:30,Final,Molly McCann,84519,Gillian Robertson,84577,False,True,SUB,2,2:05,,,Rear Naked Choke,,32.0,1.0,0.0,10.0,0.0,0.0,0.0,0.0,0.0,0:00,0.0,49.0,0.0,1.0,16.0,0.0,1.0,4.0,2.0,1.0,0:00,0.0
27.05.2018,UFC Fight Night: Thompson vs. Till,27.05.2018,97004,97008,2018-05-27,03:30,Final,Carlo Pedersoli,84579,Bradley Scott,91680,True,False,S Dec,3,5:00,,,,,137.0,35.0,7.0,39.0,22.0,6.0,4.0,3.0,0.0,0:00,0.0,104.0,39.0,12.0,32.0,16.0,10.0,0.0,0.0,0.0,0:00,1.0
27.05.2018,UFC Fight Night: Thompson vs. Till,27.05.2018,97004,97006,2018-05-27,03:30,Final,Daniel Kelly,95119,Tom Breese,84501,False,True,KO,1,3:33,Punch,,,,19.0,3.0,6.0,1.0,1.0,4.0,0.0,0.0,0.0,0:00,0.0,41.0,3.0,0.0,21.0,2.0,0.0,0.0,0.0,0.0,0:00,1.0
27.05.2018,UFC Fight Night: Thompson vs. Till,27.05.2018,97004,97005,2018-05-27,03:30,Final,Elias Theodorou,84705,Trevor Smith,85555,True,False,Points,3,5:00,,,,"28-29, 27-30, 27-30",83.0,47.0,8.0,37.0,33.0,7.0,0.0,0.0,0.0,0:00,0.0,48.0,27.0,6.0,14.0,21.0,6.0,11.0,3.0,0.0,0:00,0.0
27.05.2018,UFC Fight Night: Thompson vs. Till,27.05.2018,97004,97010,2018-05-27,03:30,Final,Darren Till,84504,Stephen Thompson,84532,True,False,Points,5,5:00,,,,"46-49, 46-49, 47-48",87.0,12.0,27.0,18.0,5.0,15.0,0.0,0.0,0.0,0:00,1.0,92.0,19.0,15.0,8.0,13.0,9.0,1.0,0.0,0.0,0:00,0.0
01.06.2018,UFC Fight Night: Rivera vs. Moraes,01.06.2018,97017,97030,2018-06-01,19:00,Final,Gian Villante,84417,Sam Alvey,84368,False,True,S Dec,3,5:00,,,,,91.0,23.0,19.0,20.0,12.0,18.0,0.0,0.0,0.0,0:00,0.0,104.0,4.0,14.0,40.0,2.0,11.0,0.0,0.0,0.0,0:00,1.0
01.06.2018,UFC Fight Night: Rivera vs. Moraes,01.06.2018,97017,97029,2018-06-01,19:00,Final,Daniel Teymur,84429,Julio Arce,84947,False,True,SUB,3,2:55,,,Rear Naked Choke,,47.0,7.0,48.0,5.0,4.0,28.0,2.0,0.0,0.0,0:00,0.0,141.0,31.0,6.0,37.0,21.0,5.0,1.0,0.0,1.0,0:00,0.0
01.06.2018,UFC Fight Night: Rivera vs. Moraes,01.06.2018,97017,97028,2018-06-01,19:00,Final,Ben Saunders,84884,Jake Ellenberger,91298,True,False,KO,1,1:56,Knee,,,,17.0,4.0,0.0,7.0,3.0,0.0,0.0,0.0,0.0,0:00,1.0,8.0,1.0,0.0,4.0,1.0,0.0,0.0,0.0,0.0,0:00,0.0
01.06.2018,UFC Fight Night: Rivera vs. Moraes,01.06.2018,97017,97027,2018-06-01,19:00,Final,Daniel Spitz,84476,Walt Harris,84814,False,True,KO,2,4:59,Punches,,,,17.0,13.0,12.0,1.0,5.0,11.0,0.0,0.0,0.0,0:00,0.0,61.0,14.0,4.0,19.0,6.0,4.0,0.0,0.0,0.0,0:00,1.0
01.06.2018,UFC Fight Night: Rivera vs. Moraes,01.06.2018,97017,97026,2018-06-01,19:00,Final,Gregor Gillespie,84288,Vinc Pichel,85036,True,False,SUB,2,4:06,,,Arm Triangle,,24.0,1.0,1.0,11.0,1.0,1.0,9.0,7.0,2.0,0:00,0.0,21.0,0.0,1.0,6.0,0.0,1.0,0.0,0.0,0.0,0:00,0.0
01.06.2018,UFC Fight Night: Rivera vs. Moraes,01.06.2018,97017,97025,2018-06-01,19:00,Final,Jimmie Rivera,84380,Marlon Moraes,84316,False,True,KO,1,0:33,Kick,,,,3.0,0.0,0.0,0.0,0.0,0.0,0.0,0.0,0.0,0:00,0.0,8.0,0.0,1.0,6.0,0.0,1.0,0.0,0.0,0.0,0:00,1.0
01.06.2018,UFC Fight Night: Rivera vs. Moraes,01.06.2018,97017,97023,2018-06-01,19:00,Final,Chance Rencountre,84258,Belal Muhammad,84280,False,True,Points,3,5:00,,,,"30-27, 30-27, 30-27",102.0,14.0,7.0,8.0,3.0,5.0,3.0,0.0,0.0,0:00,0.0,99.0,11.0,20.0,45.0,8.0,17.0,4.0,3.0,1.0,0:00,0.0
01.06.2018,UFC Fight Night: Rivera vs. Moraes,01.06.2018,97017,97022,2018-06-01,19:00,Final,David Teymur,84325,Nik Lentz,84389,True,False,Points,3,5:00,,,,"28-29, 27-30, 27-30",141.0,20.0,26.0,31.0,12.0,24.0,0.0,0.0,0.0,0:00,0.0,107.0,28.0,9.0,31.0,24.0,6.0,5.0,0.0,0.0,0:00,0.0
01.06.2018,UFC Fight Night: Rivera vs. Moraes,01.06.2018,97017,97021,2018-06-01,19:00,Final,Sijara Eubanks,84842,Lauren Murphy,85145,True,False,Points,3,5:00,,,,"27-30, 27-30, 28-29",179.0,22.0,12.0,51.0,13.0,11.0,4.0,2.0,0.0,0:00,0.0,101.0,17.0,7.0,35.0,11.0,3.0,2.0,0.0,0.0,0:00,0.0
01.06.2018,UFC Fight Night: Rivera vs. Moraes,01.06.2018,97017,97019,2018-06-01,19:00,Final,Jose Torres,97020,Jarred Brooks,96539,True,False,KO,2,2:55,Punches,,,,51.0,8.0,3.0,14.0,5.0,3.0,3.0,1.0,0.0,0:00,0.0,53.0,16.0,0.0,17.0,14.0,0.0,5.0,2.0,0.0,0:00,0.0
01.06.2018,UFC Fight Night: Rivera vs. Moraes,01.06.2018,97017,97018,2018-06-01,19:00,Final,Nathaniel Wood,84613,Johnny Eduardo,90535,True,False,SUB,2,2:18,,,D'Arce Choke,,73.0,7.0,17.0,20.0,3.0,10.0,0.0,0.0,1.0,0:00,0.0,72.0,8.0,8.0,27.0,3.0,7.0,1.0,0.0,0.0,0:00,0.0
01.06.2018,UFC Fight Night: Rivera vs. Moraes,01.06.2018,97017,97024,2018-06-01,19:00,Final,Desmond Green,84632,Gleison Tibau,91224,True,False,Points,3,5:00,,,,"27-29, 27-30, 27-30",160.0,27.0,4.0,61.0,13.0,3.0,0.0,0.0,0.0,0:00,0.0,159.0,17.0,2.0,20.0,6.0,2.0,3.0,0.0,0.0,0:00,0.0
09.06.2018,UFC 225: Whittaker vs. Romero 2,09.06.2018,97031,97039,2018-06-09,17:00,Final,Chris de la Rocha,91438,Rashad Coulter,96420,True,False,KO,2,3:53,Punches,,,,75.0,3.0,1.0,36.0,3.0,1.0,4.0,3.0,2.0,0:00,0.0,52.0,5.0,0.0,26.0,4.0,0.0,1.0,0.0,0.0,0:00,0.0
09.06.2018,UFC 225: Whittaker vs. Romero 2,09.06.2018,97031,97043,2018-06-09,19:00,Final,Tai Tuivasa,84861,Andrei Arlovski,84694,True,False,Points,3,5:00,,,,"28-29, 28-29, 28-29",98.0,15.0,7.0,36.0,12.0,6.0,0.0,0.0,0.0,0:00,1.0,97.0,10.0,18.0,32.0,7.0,12.0,2.0,0.0,0.0,0:00,0.0
09.06.2018,UFC 225: Whittaker vs. Romero 2,09.06.2018,97031,97044,2018-06-09,19:00,Final,Mike Jackson,95842,CM Punk,96123,False,False,No Contest,3,5:00,,,,,95.0,12.0,1.0,54.0,10.0,0.0,1.0,1.0,0.0,0:00,0.0,63.0,13.0,5.0,10.0,7.0,2.0,9.0,1.0,0.0,0:00,0.0
09.06.2018,UFC 225: Whittaker vs. Romero 2,09.06.2018,97031,97041,2018-06-09,19:00,Final,Colby Covington,85319,Rafael Dos Anjos,84838,True,False,Points,5,5:00,,,,"47-48, 47-48, 46-49",229.0,33.0,34.0,54.0,14.0,31.0,18.0,7.0,0.0,0:00,0.0,139.0,45.0,14.0,54.0,37.0,14.0,6.0,3.0,0.0,0:00,0.0
09.06.2018,UFC 225: Whittaker vs. Romero 2,09.06.2018,97031,97040,2018-06-09,19:00,Final,Yoel Romero,84793,Robert Whittaker,84355,False,True,S Dec,5,5:00,,,,,194.0,27.0,19.0,76.0,19.0,16.0,10.0,3.0,0.0,0:00,2.0,225.0,39.0,62.0,57.0,23.0,48.0,1.0,0.0,0.0,0:00,0.0
09.06.2018,UFC 225: Whittaker vs. Romero 2,09.06.2018,97031,97038,2018-06-09,17:00,Final,Mirsad Bektic,85086,Ricardo Lamas,84922,True,False,S Dec,3,5:00,,,,,65.0,18.0,6.0,12.0,15.0,4.0,4.0,2.0,0.0,0:00,0.0,34.0,23.0,5.0,8.0,21.0,5.0,4.0,0.0,2.0,0:00,0.0
09.06.2018,UFC 225: Whittaker vs. Romero 2,09.06.2018,97031,97042,2018-06-09,19:00,Final,Megan Anderson,84835,Holly Holm,84448,False,True,Points,3,5:00,,,,"30-26, 30-26, 30-27",42.0,16.0,0.0,15.0,11.0,0.0,0.0,0.0,0.0,0:00,0.0,47.0,14.0,10.0,27.0,12.0,8.0,8.0,4.0,1.0,0:00,0.0
09.06.2018,UFC 225: Whittaker vs. Romero 2,09.06.2018,97031,97036,2018-06-09,17:00,Final,Curtis Blaydes,84535,Alistair Overeem,84674,True,False,KO,3,2:56,Elbows,,,,48.0,5.0,0.0,32.0,5.0,0.0,4.0,4.0,0.0,0:00,0.0,8.0,4.0,0.0,3.0,4.0,0.0,0.0,0.0,2.0,0:00,0.0
09.06.2018,UFC 225: Whittaker vs. Romero 2,09.06.2018,97031,97035,2018-06-09,15:15,Final,Dan Ige,84617,Mike Santiago,96605,True,False,KO,1,0:50,Punches,,,,27.0,0.0,0.0,25.0,0.0,0.0,1.0,1.0,0.0,0:00,0.0,1.0,0.0,0.0,0.0,0.0,0.0,0.0,0.0,0.0,0:00,0.0
09.06.2018,UFC 225: Whittaker vs. Romero 2,09.06.2018,97031,97034,2018-06-09,15:15,Final,Charles Oliveira,84324,Clay Guida,84900,True,False,SUB,1,2:18,,,Guillotine Choke,,18.0,2.0,9.0,6.0,1.0,7.0,0.0,0.0,1.0,0:00,0.0,20.0,3.0,2.0,4.0,3.0,2.0,1.0,0.0,0.0,0:00,0.0
09.06.2018,UFC 225: Whittaker vs. Romero 2,09.06.2018,97031,97033,2018-06-09,15:15,Final,Sergio Pettis,85410,Joseph Benavidez,84289,True,False,S Dec,3,5:00,,,,,155.0,13.0,0.0,69.0,5.0,0.0,0.0,0.0,0.0,0:00,0.0,128.0,33.0,25.0,28.0,14.0,17.0,14.0,2.0,0.0,0:00,0.0
09.06.2018,UFC 225: Whittaker vs. Romero 2,09.06.2018,97031,97032,2018-06-09,15:15,Final,Anthony Smith,84592,Rashad Evans,92066,True,False,KO,1,0:53,Knee,,,,7.0,0.0,2.0,4.0,0.0,2.0,1.0,0.0,0.0,0:00,1.0,6.0,0.0,0.0,1.0,0.0,0.0,1.0,0.0,0.0,0:00,0.0
09.06.2018,UFC 225: Whittaker vs. Romero 2,09.06.2018,97031,97037,2018-06-09,17:00,Final,Carla Esparza,84691,Claudia Gadelha,85047,False,True,S Dec,3,5:00,,,,,89.0,3.0,11.0,33.0,3.0,7.0,4.0,2.0,0.0,0:00,0.0,59.0,5.0,0.0,23.0,3.0,0.0,5.0,4.0,1.0,0:00,0.0
11.06.2018,"DWTNCS Season 2, Week 1",11.06.2018,97045,97046,2018-06-11,21:00,Final,Dashawn Boatwright,97047,Alonzo Menifield,84284,False,True,KO,1,0:08,Punches,,,,1.0,0.0,0.0,0.0,0.0,0.0,0.0,0.0,0.0,0:00,0.0,8.0,0.0,0.0,7.0,0.0,0.0,0.0,0.0,0.0,0:00,0.0
11.06.2018,"DWTNCS Season 2, Week 1",11.06.2018,97045,97048,2018-06-11,21:00,Final,Sean Lally,97049,Chris Curtis,97050,False,True,KO,3,1:37,Kick,,,,131.0,15.0,12.0,43.0,7.0,12.0,0.0,0.0,0.0,0:00,0.0,106.0,11.0,3.0,73.0,9.0,2.0,0.0,0.0,0.0,0:00,1.0
11.06.2018,"DWTNCS Season 2, Week 1",11.06.2018,97045,97051,2018-06-11,21:00,Final,Austen Lane,97052,Greg Hardy,84287,False,True,KO,1,0:57,Punch,,,,11.0,2.0,1.0,4.0,0.0,1.0,0.0,0.0,0.0,0:00,0.0,15.0,0.0,0.0,6.0,0.0,0.0,0.0,0.0,0.0,0:00,1.0
11.06.2018,"DWTNCS Season 2, Week 1",11.06.2018,97045,97053,2018-06-11,21:00,Final,Rico DiSciullo,97054,Montel Jackson,84652,False,True,KO,3,2:15,Knee,,,,43.0,8.0,12.0,6.0,4.0,11.0,1.0,0.0,0.0,0:00,0.0,98.0,22.0,4.0,37.0,13.0,4.0,3.0,3.0,0.0,0:00,2.0
11.06.2018,"DWTNCS Season 2, Week 1",11.06.2018,97045,97055,2018-06-11,21:00,Final,Will Santiago Jr.,97056,Kevin Holland,84759,False,True,Points,3,5:00,,,,"30-27, 30-27, 30-27",48.0,7.0,1.0,16.0,6.0,0.0,2.0,1.0,0.0,0:00,0.0,130.0,31.0,29.0,41.0,19.0,23.0,3.0,0.0,0.0,0:00,0.0
18.06.2018,"DWTNCS Season 2, Week 2",18.06.2018,97057,97062,2018-06-18,21:00,Final,Emiliano Sordi,97063,Ryan Spann,84831,False,True,SUB,1,0:26,,,Guillotine Choke,,5.0,0.0,1.0,4.0,0.0,1.0,1.0,0.0,0.0,0:00,0.0,7.0,0.0,0.0,4.0,0.0,0.0,0.0,0.0,1.0,0:00,1.0
18.06.2018,"DWTNCS Season 2, Week 2",18.06.2018,97057,97061,2018-06-18,21:00,Final,Austin Springer,88069,Giga Chikadze,85479,True,False,SUB,3,4:10,,,Rear Naked Choke,,61.0,12.0,4.0,36.0,10.0,3.0,9.0,4.0,1.0,0:00,0.0,46.0,16.0,3.0,27.0,8.0,3.0,1.0,0.0,0.0,0:00,0.0
18.06.2018,"DWTNCS Season 2, Week 2",18.06.2018,97057,97064,2018-06-18,21:00,Final,Tyler Hill,97065,Dwight Grant,84580,False,True,KO,2,2:08,Punch,,,,47.0,10.0,9.0,13.0,4.0,9.0,1.0,0.0,0.0,0:00,0.0,63.0,3.0,6.0,30.0,2.0,6.0,0.0,0.0,0.0,0:00,1.0
18.06.2018,"DWTNCS Season 2, Week 2",18.06.2018,97057,97058,2018-06-18,21:00,Final,Yazan Hajeh,97059,Matt Sayles,84806,False,True,KO,1,1:57,Punches,,,,9.0,2.0,1.0,2.0,1.0,0.0,1.0,0.0,0.0,0:00,0.0,55.0,4.0,2.0,29.0,4.0,1.0,2.0,0.0,0.0,0:00,1.0
18.06.2018,"DWTNCS Season 2, Week 2",18.06.2018,97057,97060,2018-06-18,21:00,Final,Jordan Wright,87891,Anthony Hernandez,84295,False,False,No Contest,1,0:40,,,,,5.0,1.0,1.0,0.0,1.0,1.0,0.0,0.0,0.0,0:00,0.0,14.0,0.0,0.0,10.0,0.0,0.0,0.0,0.0,0.0,0:00,1.0
23.06.2018,UFC Fight Night: Cowboy vs. Edwards,23.06.2018,97066,97079,2018-06-23,05:00,Final,Daichi Abe,96663,Li Jingliang,85379,False,True,Points,3,5:00,,,,"30-27, 30-27, 30-26",123.0,6.0,25.0,24.0,1.0,20.0,0.0,0.0,0.0,0:00,0.0,111.0,23.0,72.0,32.0,13.0,51.0,0.0,0.0,0.0,0:00,0.0
23.06.2018,UFC Fight Night: Cowboy vs. Edwards,23.06.2018,97066,97078,2018-06-23,05:00,Final,Jessica Eye,84858,Jessica-Rose Clark,84816,True,False,Points,3,5:00,,,,"28-29, 28-29, 27-30",182.0,35.0,8.0,38.0,23.0,6.0,2.0,1.0,0.0,0:00,0.0,111.0,18.0,10.0,30.0,13.0,8.0,0.0,0.0,0.0,0:00,0.0
23.06.2018,UFC Fight Night: Cowboy vs. Edwards,23.06.2018,97066,97077,2018-06-23,05:00,Final,Tyson Pedro,96235,Ovince Saint Preux,84455,False,True,SUB,1,2:54,,,Armbar,,6.0,4.0,2.0,5.0,3.0,1.0,4.0,0.0,1.0,0:00,1.0,9.0,3.0,0.0,5.0,2.0,0.0,1.0,0.0,1.0,0:00,0.0
23.06.2018,UFC Fight Night: Cowboy vs. Edwards,23.06.2018,97066,97076,2018-06-23,05:00,Final,Leon Edwards,84507,Donald Cerrone,84260,True,False,Points,5,5:00,,,,"47-48, 47-48, 47-48",105.0,27.0,34.0,37.0,19.0,28.0,4.0,0.0,0.0,0:00,0.0,67.0,40.0,24.0,17.0,30.0,13.0,9.0,1.0,0.0,0:00,0.0
23.06.2018,UFC Fight Night: Cowboy vs. Edwards,23.06.2018,97066,97075,2018-06-23,01:30,Final,Melinda Fabian,96783,Ji Yeon Kim,85493,False,True,S Dec,3,5:00,,,,,127.0,18.0,28.0,39.0,11.0,22.0,1.0,0.0,0.0,0:00,0.0,205.0,29.0,7.0,46.0,22.0,5.0,0.0,0.0,0.0,0:00,0.0
23.06.2018,UFC Fight Night: Cowboy vs. Edwards,23.06.2018,97066,97074,2018-06-23,01:30,Final,Ulka Sasaki,91411,Jenel Lausa,96225,True,False,SUB,2,4:04,,,Rear Naked Choke,,46.0,8.0,2.0,18.0,6.0,1.0,7.0,5.0,1.0,0:00,0.0,10.0,3.0,1.0,4.0,2.0,1.0,0.0,0.0,0.0,0:00,0.0
23.06.2018,UFC Fight Night: Cowboy vs. Edwards,23.06.2018,97066,97073,2018-06-23,01:30,Final,Naoki Inoue,96454,Matt Schnell,84599,False,True,S Dec,3,5:00,,,,,172.0,4.0,20.0,35.0,2.0,11.0,1.0,0.0,0.0,0:00,0.0,141.0,12.0,30.0,43.0,5.0,23.0,1.0,0.0,0.0,0:00,0.0
23.06.2018,UFC Fight Night: Cowboy vs. Edwards,23.06.2018,97066,97071,2018-06-23,01:30,Final,Jake Matthews,85497,Shinsho Anzai,95659,True,False,SUB,1,2:44,,,Rear Naked Choke,,16.0,3.0,0.0,9.0,3.0,0.0,1.0,1.0,1.0,0:00,0.0,4.0,1.0,0.0,0.0,1.0,0.0,1.0,0.0,0.0,0:00,0.0
23.06.2018,UFC Fight Night: Cowboy vs. Edwards,23.06.2018,97066,97070,2018-06-23,01:30,Final,Hector Aldana,85514,Song Kenan,85382,False,True,KO,2,4:45,Punch,,,,59.0,10.0,21.0,17.0,6.0,16.0,2.0,2.0,0.0,0:00,0.0,52.0,5.0,14.0,17.0,3.0,12.0,0.0,0.0,0.0,0:00,1.0
23.06.2018,UFC Fight Night: Cowboy vs. Edwards,23.06.2018,97066,97069,2018-06-23,01:30,Final,Shane Young,84343,Rolando Dy,96449,True,False,KO,2,4:40,Elbow,,,,183.0,22.0,10.0,74.0,20.0,10.0,5.0,1.0,0.0,0:00,0.0,131.0,18.0,3.0,41.0,13.0,3.0,0.0,0.0,0.0,0:00,0.0
23.06.2018,UFC Fight Night: Cowboy vs. Edwards,23.06.2018,97066,97068,2018-06-23,01:30,Final,Song Yadong,84446,Felipe Arantes,93609,True,False,KO,2,4:59,Elbow,,,,80.0,13.0,7.0,26.0,7.0,6.0,1.0,1.0,1.0,0:00,1.0,27.0,3.0,1.0,7.0,0.0,1.0,2.0,0.0,0.0,0:00,0.0
23.06.2018,UFC Fight Night: Cowboy vs. Edwards,23.06.2018,97066,97067,2018-06-23,01:30,Final,Petr Yan,84433,Teruto Ishihara,84352,True,False,KO,1,3:28,Punch,,,,32.0,8.0,0.0,18.0,7.0,0.0,0.0,0.0,0.0,0:00,2.0,18.0,5.0,7.0,4.0,2.0,5.0,2.0,0.0,0.0,0:00,0.0
23.06.2018,UFC Fight Night: Cowboy vs. Edwards,23.06.2018,97066,97072,2018-06-23,01:30,Final,Yan Xiaonan,84855,Viviane Pereira,96272,True,False,Points,3,5:00,,,,"27-30, 28-29, 28-29",174.0,8.0,45.0,42.0,2.0,27.0,0.0,0.0,0.0,0:00,0.0,189.0,23.0,0.0,34.0,10.0,0.0,0.0,0.0,0.0,0:00,0.0
25.06.2018,"DWTNCS Season 2, Week 3",25.06.2018,97080,97086,2018-06-25,21:00,Final,Jamall Emmers,87638,Julian Erosa,84596,False,True,KO,2,1:10,Kick,,,,61.0,9.0,4.0,40.0,8.0,3.0,0.0,0.0,0.0,0:00,1.0,72.0,16.0,10.0,33.0,12.0,9.0,1.0,0.0,0.0,0:00,1.0
25.06.2018,"DWTNCS Season 2, Week 3",25.06.2018,97080,97085,2018-06-25,21:00,Final,Josh Parisian,87966,Greg Rebello,96493,True,False,KO,1,1:31,Spinning Back Fist,,,,11.0,6.0,1.0,4.0,4.0,0.0,0.0,0.0,0.0,0:00,1.0,3.0,2.0,0.0,3.0,1.0,0.0,0.0,0.0,0.0,0:00,0.0
25.06.2018,"DWTNCS Season 2, Week 3",25.06.2018,97080,97087,2018-06-25,21:00,Final,Jordan Williams,85132,Tim Caron,97088,False,False,No Contest,3,3:37,,,,,88.0,20.0,0.0,74.0,20.0,0.0,3.0,3.0,0.0,0:00,0.0,11.0,4.0,1.0,3.0,4.0,1.0,2.0,0.0,0.0,0:00,0.0
25.06.2018,"DWTNCS Season 2, Week 3",25.06.2018,97080,97081,2018-06-25,21:00,Final,Jaimelene Nievera,97082,Antonina Shevchenko,84668,False,True,KO,2,3:22,Knees,,,,12.0,6.0,8.0,5.0,4.0,5.0,6.0,1.0,0.0,0:00,0.0,84.0,25.0,1.0,51.0,21.0,1.0,0.0,0.0,0.0,0:00,0.0
25.06.2018,"DWTNCS Season 2, Week 3",25.06.2018,97080,97083,2018-06-25,21:00,Final,Te Edwards,84254,Austin Tweedy,97084,True,False,KO,1,0:28,Punch,,,,3.0,0.0,0.0,3.0,0.0,0.0,0.0,0.0,0.0,0:00,1.0,1.0,0.0,2.0,0.0,0.0,2.0,0.0,0.0,0.0,0:00,0.0
06.07.2018,The Ultimate Fighter 27 Finale,06.07.2018,97089,97106,2018-07-06,19:00,Final,Barb Honchak,96767,Roxanne Modafferi,84669,False,True,KO,2,3:32,Elbows,,,,76.0,4.0,0.0,23.0,1.0,0.0,1.0,0.0,0.0,0:00,0.0,128.0,1.0,0.0,50.0,1.0,0.0,1.0,1.0,0.0,0:00,0.0
06.07.2018,The Ultimate Fighter 27 Finale,06.07.2018,97089,97105,2018-07-06,19:00,Final,Martin Bravo,85421,Alex Caceres,84401,False,True,S Dec,3,5:00,,,,,204.0,17.0,15.0,61.0,10.0,7.0,9.0,3.0,0.0,0:00,0.0,134.0,23.0,2.0,60.0,20.0,2.0,1.0,0.0,0.0,0:00,0.0
06.07.2018,The Ultimate Fighter 27 Finale,06.07.2018,97089,97103,2018-07-06,19:00,Final,Brad Katona,84712,Jay Cucciniello,97104,True,False,Points,3,5:00,,,,"26-30, 26-30, 26-30",74.0,13.0,24.0,42.0,8.0,21.0,7.0,2.0,0.0,0:00,0.0,55.0,8.0,1.0,8.0,5.0,1.0,1.0,0.0,0.0,0:00,0.0
06.07.2018,The Ultimate Fighter 27 Finale,06.07.2018,97089,97101,2018-07-06,19:00,Final,Joe Giannetti,97102,Michael Trizano,84850,False,True,S Dec,3,5:00,,,,,43.0,17.0,15.0,3.0,11.0,15.0,6.0,1.0,0.0,0:00,0.0,26.0,18.0,27.0,9.0,7.0,26.0,0.0,0.0,1.0,0:00,0.0
06.07.2018,The Ultimate Fighter 27 Finale,06.07.2018,97089,97100,2018-07-06,19:00,Final,Israel Adesanya,84359,Brad Tavares,85598,True,False,Points,5,5:00,,,,"45-50, 45-50, 46-49",144.0,29.0,42.0,61.0,21.0,37.0,2.0,0.0,1.0,0:00,0.0,163.0,8.0,3.0,34.0,3.0,3.0,12.0,1.0,0.0,0:00,0.0
06.07.2018,The Ultimate Fighter 27 Finale,06.07.2018,97089,97107,2018-07-06,19:00,Final,Julian Marquez,88027,Alessio Di Chirico,85005,False,True,S Dec,3,5:00,,,,,120.0,21.0,6.0,28.0,16.0,3.0,1.0,0.0,2.0,0:00,0.0,90.0,19.0,7.0,30.0,14.0,6.0,6.0,4.0,0.0,0:00,0.0
06.07.2018,The Ultimate Fighter 27 Finale,06.07.2018,97089,97095,2018-07-06,17:00,Final,Allan Zuniga,97096,John Gunther,97097,False,True,M Dec,3,5:00,,,,,78.0,24.0,10.0,33.0,18.0,8.0,0.0,0.0,1.0,0:00,0.0,61.0,6.0,4.0,22.0,2.0,3.0,19.0,8.0,0.0,0:00,0.0
06.07.2018,The Ultimate Fighter 27 Finale,06.07.2018,97089,97093,2018-07-06,17:00,Final,Richie Smullen,97094,Luis Pena,84741,False,True,SUB,1,3:32,,,Guillotine Choke,,5.0,1.0,3.0,3.0,1.0,3.0,3.0,2.0,0.0,0:00,0.0,22.0,1.0,0.0,8.0,0.0,0.0,1.0,1.0,1.0,0:00,1.0
06.07.2018,The Ultimate Fighter 27 Finale,06.07.2018,97089,97092,2018-07-06,17:00,Final,Rachael Ostovich,84276,Montana De La Rosa,84346,False,True,SUB,3,4:21,,,Rear Naked Choke,,69.0,23.0,4.0,23.0,15.0,2.0,0.0,0.0,1.0,0:00,0.0,134.0,12.0,3.0,46.0,7.0,3.0,6.0,0.0,1.0,0:00,0.0
06.07.2018,The Ultimate Fighter 27 Finale,06.07.2018,97089,97091,2018-07-06,16:00,Final,Oskar Piechota,85335,Gerald Meerschaert,84758,False,True,SUB,2,4:55,,,Rear Naked Choke,,46.0,4.0,3.0,17.0,3.0,3.0,1.0,1.0,2.0,0:00,1.0,95.0,7.0,2.0,43.0,6.0,2.0,4.0,3.0,2.0,0:00,0.0
06.07.2018,The Ultimate Fighter 27 Finale,06.07.2018,97089,97090,2018-07-06,16:00,Final,Steven Peterson,84740,Matt Bessette,96491,True,False,S Dec,3,5:00,,,,,141.0,23.0,11.0,44.0,19.0,11.0,6.0,2.0,1.0,0:00,0.0,121.0,15.0,5.0,42.0,12.0,3.0,3.0,0.0,0.0,0:00,0.0
06.07.2018,The Ultimate Fighter 27 Finale,06.07.2018,97089,97098,2018-07-06,17:00,Final,Bryce Mitchell,84728,Tyler Diamond,97099,True,False,M Dec,3,5:00,,,,,50.0,18.0,1.0,29.0,9.0,0.0,10.0,3.0,1.0,0:00,0.0,88.0,14.0,5.0,34.0,12.0,5.0,4.0,3.0,0.0,0:00,0.0
07.07.2018,UFC 226: Miocic vs. Cormier,07.07.2018,97108,97119,2018-07-07,19:00,Final,Khalil Rountree Jr.,84659,Gokhan Saki,84522,True,False,KO,1,1:36,Punches,,,,17.0,0.0,0.0,9.0,0.0,0.0,0.0,0.0,0.0,0:00,1.0,7.0,1.0,3.0,2.0,0.0,3.0,0.0,0.0,0.0,0:00,0.0
07.07.2018,UFC 226: Miocic vs. Cormier,07.07.2018,97108,97118,2018-07-07,19:00,Final,Anthony Pettis,84533,Michael Chiesa,84931,True,False,SUB,2,0:52,,,Triangle Choke,,13.0,6.0,3.0,3.0,4.0,2.0,0.0,0.0,2.0,0:00,0.0,17.0,7.0,2.0,4.0,7.0,1.0,6.0,2.0,0.0,0:00,0.0
07.07.2018,UFC 226: Miocic vs. Cormier,07.07.2018,97108,97117,2018-07-07,19:00,Final,Mike Perry,84797,Paul Felder,84396,True,False,S Dec,3,5:00,,,,,78.0,18.0,14.0,34.0,15.0,13.0,3.0,2.0,0.0,0:00,0.0,79.0,24.0,17.0,27.0,16.0,13.0,1.0,0.0,0.0,0:00,0.0
07.07.2018,UFC 226: Miocic vs. Cormier,07.07.2018,97108,97116,2018-07-07,19:00,Final,Derrick Lewis,84479,Francis Ngannou,84393,True,False,Points,3,5:00,,,,"27-30, 28-29, 28-29",26.0,18.0,10.0,1.0,11.0,8.0,2.0,0.0,0.0,0:00,0.0,39.0,6.0,1.0,7.0,3.0,1.0,0.0,0.0,0.0,0:00,0.0
07.07.2018,UFC 226: Miocic vs. Cormier,07.07.2018,97108,97115,2018-07-07,19:00,Final,Daniel Cormier,85202,Stipe Miocic,85201,True,False,KO,1,4:33,Punches,,,,30.0,1.0,6.0,20.0,1.0,4.0,0.0,0.0,0.0,0:00,1.0,41.0,7.0,3.0,15.0,6.0,3.0,1.0,1.0,0.0,0:00,0.0
07.07.2018,UFC 226: Miocic vs. Cormier,07.07.2018,97108,97112,2018-07-07,17:00,Final,Rob Font,85000,Raphael Assuncao,84315,False,True,Points,3,5:00,,,,"30-27, 30-27, 30-27",105.0,10.0,7.0,12.0,6.0,2.0,0.0,0.0,0.0,0:00,0.0,98.0,7.0,15.0,41.0,4.0,9.0,2.0,2.0,0.0,0:00,0.0
07.07.2018,UFC 226: Miocic vs. Cormier,07.07.2018,97108,97113,2018-07-07,17:00,Final,Drakkar Klose,85088,Lando Vannata,84334,True,False,Points,3,5:00,,,,"27-30, 27-30, 27-30",68.0,10.0,20.0,29.0,9.0,17.0,4.0,1.0,0.0,0:00,0.0,80.0,30.0,23.0,18.0,15.0,17.0,4.0,1.0,0.0,0:00,0.0
07.07.2018,UFC 226: Miocic vs. Cormier,07.07.2018,97108,97111,2018-07-07,17:00,Final,Paulo Costa,85206,Uriah Hall,85341,True,False,KO,2,2:38,Punches,,,,73.0,40.0,3.0,39.0,33.0,3.0,0.0,0.0,0.0,0:00,1.0,102.0,15.0,5.0,45.0,8.0,5.0,1.0,0.0,0.0,0:00,0.0
07.07.2018,UFC 226: Miocic vs. Cormier,07.07.2018,97108,97110,2018-07-07,16:00,Final,Emily Whitmire,84378,Jamie Moyle,96244,True,False,Points,3,5:00,,,,"28-29, 28-29, 28-29",159.0,13.0,11.0,33.0,9.0,11.0,2.0,1.0,0.0,0:00,0.0,81.0,22.0,14.0,24.0,13.0,13.0,3.0,0.0,0.0,0:00,0.0
07.07.2018,UFC 226: Miocic vs. Cormier,07.07.2018,97108,97109,2018-07-07,16:00,Final,Gilbert Burns,84888,Dan Hooker,85116,False,True,KO,1,2:28,Punches,,,,16.0,2.0,10.0,5.0,1.0,7.0,1.0,0.0,0.0,0:00,0.0,23.0,4.0,7.0,12.0,4.0,6.0,0.0,0.0,1.0,0:00,2.0
07.07.2018,UFC 226: Miocic vs. Cormier,07.07.2018,97108,97114,2018-07-07,17:00,Final,Max Griffin,84301,Curtis Millender,84498,False,True,Points,3,5:00,,,,"29-28, 29-28, 29-28",75.0,14.0,10.0,28.0,7.0,9.0,2.0,1.0,0.0,0:00,0.0,71.0,15.0,8.0,23.0,10.0,5.0,1.0,1.0,0.0,0:00,0.0
10.07.2018,"DWTNCS Season 2, Week 4",10.07.2018,97120,97129,2018-07-09,21:00,Final,Max Mustaki,97130,Jalin Turner,84338,False,True,TKO - Dr,1,5:00,,,,,71.0,9.0,2.0,35.0,4.0,2.0,0.0,0.0,0.0,0:00,0.0,96.0,23.0,1.0,50.0,14.0,1.0,1.0,1.0,0.0,0:00,1.0
10.07.2018,"DWTNCS Season 2, Week 4",10.07.2018,97120,97127,2018-07-09,21:00,Final,Rilley Dutro,97128,Jordan Espinosa,84737,False,True,KO,3,4:58,Punch,,,,69.0,47.0,14.0,34.0,26.0,11.0,3.0,0.0,0.0,0:00,0.0,103.0,24.0,6.0,63.0,20.0,6.0,6.0,1.0,0.0,0:00,3.0
10.07.2018,"DWTNCS Season 2, Week 4",10.07.2018,97120,97123,2018-07-09,21:00,Final,Alton Cunningham,85012,Bevon Lewis,84870,False,True,KO,1,3:01,Knees,,,,5.0,2.0,1.0,2.0,2.0,1.0,0.0,0.0,0.0,0:00,0.0,33.0,10.0,4.0,17.0,9.0,3.0,1.0,0.0,0.0,0:00,1.0
10.07.2018,"DWTNCS Season 2, Week 4",10.07.2018,97120,97121,2018-07-09,21:00,Final,Joey Gomez,97122,Kevin Aguilar,84746,False,True,S Dec,3,5:00,,,,,111.0,2.0,0.0,54.0,2.0,0.0,7.0,2.0,0.0,0:00,0.0,86.0,15.0,1.0,37.0,12.0,1.0,0.0,0.0,0.0,0:00,1.0
10.07.2018,"DWTNCS Season 2, Week 4",10.07.2018,97120,97124,2018-07-09,21:00,Final,Ricky Palacios,97125,Toby Misech,97126,True,False,Points,3,5:00,,,,"27-30, 28-29, 28-29",135.0,30.0,51.0,53.0,25.0,38.0,0.0,0.0,0.0,0:00,0.0,94.0,17.0,10.0,33.0,9.0,7.0,2.0,0.0,0.0,0:00,0.0
14.07.2018,UFC Fight Night: Dos Santos vs. Ivanov,14.07.2018,97131,97143,2018-07-14,16:00,Final,Niko Price,84608,Randy Brown,85002,True,False,KO,2,1:09,Punch,,,,33.0,3.0,3.0,9.0,1.0,2.0,2.0,1.0,0.0,0:00,0.0,29.0,4.0,4.0,9.0,3.0,1.0,2.0,1.0,0.0,0:00,0.0
14.07.2018,UFC Fight Night: Dos Santos vs. Ivanov,14.07.2018,97131,97145,2018-07-14,16:00,Final,Marion Reneau,84494,Cat Zingano,91501,False,True,Points,3,5:00,,,,"30-26, 30-27, 30-27",34.0,4.0,1.0,10.0,3.0,1.0,0.0,0.0,0.0,0:00,0.0,32.0,13.0,12.0,14.0,10.0,9.0,10.0,6.0,0.0,0:00,0.0
14.07.2018,UFC Fight Night: Dos Santos vs. Ivanov,14.07.2018,97131,97144,2018-07-14,16:00,Final,Myles Jury,84407,Chad Mendes,93431,False,True,KO,1,2:52,Punch,,,,6.0,1.0,5.0,0.0,1.0,2.0,0.0,0.0,0.0,0:00,0.0,24.0,0.0,3.0,16.0,0.0,1.0,0.0,0.0,0.0,0:00,1.0
14.07.2018,UFC Fight Night: Dos Santos vs. Ivanov,14.07.2018,97131,97142,2018-07-14,16:00,Final,Rick Glenn,88356,Dennis Bermudez,84279,True,False,S Dec,3,5:00,,,,,110.0,20.0,7.0,32.0,13.0,3.0,0.0,0.0,1.0,0:00,0.0,87.0,22.0,5.0,25.0,13.0,4.0,14.0,6.0,0.0,0:00,0.0
14.07.2018,UFC Fight Night: Dos Santos vs. Ivanov,14.07.2018,97131,97140,2018-07-14,16:00,Final,Junior Dos Santos,84480,Blagoy Ivanov,84488,True,False,Points,5,5:00,,,,"45-50, 45-50, 45-50",170.0,75.0,3.0,66.0,41.0,3.0,1.0,0.0,0.0,0:00,0.0,213.0,15.0,1.0,40.0,10.0,1.0,0.0,0.0,0.0,0:00,0.0
14.07.2018,UFC Fight Night: Dos Santos vs. Ivanov,14.07.2018,97131,97139,2018-07-14,16:00,Final,Raoni Barcelos,84895,Kurt Holobaugh,84897,True,False,KO,3,1:29,Punch,,,,138.0,7.0,1.0,76.0,5.0,1.0,4.0,3.0,0.0,0:00,1.0,206.0,12.0,8.0,88.0,8.0,6.0,3.0,1.0,0.0,0:00,0.0
14.07.2018,UFC Fight Night: Dos Santos vs. Ivanov,14.07.2018,97131,97141,2018-07-14,16:00,Final,Sage Northcutt,95669,Zak Ottow,84602,True,False,KO,2,3:13,Punch,,,,28.0,8.0,1.0,18.0,6.0,0.0,1.0,1.0,1.0,0:00,1.0,14.0,2.0,0.0,5.0,1.0,0.0,4.0,1.0,1.0,0:00,1.0
14.07.2018,UFC Fight Night: Dos Santos vs. Ivanov,14.07.2018,97131,97137,2018-07-14,16:00,Final,Alexander Volkanovski,84829,Darren Elkins,85074,True,False,Points,3,5:00,,,,"28-29, 28-29, 27-30",118.0,13.0,13.0,76.0,11.0,13.0,12.0,2.0,3.0,0:00,2.0,147.0,24.0,1.0,66.0,15.0,1.0,6.0,1.0,0.0,0:00,0.0
14.07.2018,UFC Fight Night: Dos Santos vs. Ivanov,14.07.2018,97131,97136,2018-07-14,16:00,Final,Alejandro Perez,84445,Eddie Wineland,84970,True,False,Points,3,5:00,,,,"28-29, 28-29, 28-29",197.0,7.0,10.0,40.0,4.0,9.0,2.0,0.0,0.0,0:00,0.0,135.0,43.0,5.0,23.0,20.0,5.0,0.0,0.0,0.0,0:00,0.0
14.07.2018,UFC Fight Night: Dos Santos vs. Ivanov,14.07.2018,97131,97135,2018-07-14,16:00,Final,Jodie Esquibel,84372,Jessica Aguilar,84756,False,True,Points,3,5:00,,,,"29-28, 29-28, 30-27",152.0,38.0,0.0,54.0,27.0,0.0,2.0,0.0,0.0,0:00,0.0,150.0,36.0,13.0,83.0,32.0,13.0,6.0,0.0,0.0,0:00,0.0
14.07.2018,UFC Fight Night: Dos Santos vs. Ivanov,14.07.2018,97131,97133,2018-07-14,16:00,Final,Mark De La Rosa,84754,Elias Garcia,97134,True,False,SUB,2,2:00,,,Rear Naked Choke,,36.0,6.0,2.0,20.0,4.0,1.0,3.0,2.0,1.0,0:00,0.0,36.0,6.0,12.0,6.0,3.0,10.0,0.0,0.0,0.0,0:00,0.0
14.07.2018,UFC Fight Night: Dos Santos vs. Ivanov,14.07.2018,97131,97132,2018-07-14,16:00,Final,Jennifer Maia,84527,Liz Carmouche,84423,False,True,Points,3,5:00,,,,"29-28, 30-27, 30-27",72.0,23.0,9.0,19.0,14.0,9.0,0.0,0.0,0.0,0:00,0.0,57.0,12.0,9.0,32.0,12.0,9.0,4.0,3.0,0.0,0:00,0.0
14.07.2018,UFC Fight Night: Dos Santos vs. Ivanov,14.07.2018,97131,97138,2018-07-14,16:00,Final,Said Nurmagomedov,84310,Justin Scoggins,94618,True,False,S Dec,3,5:00,,,,,83.0,16.0,14.0,40.0,13.0,12.0,11.0,1.0,0.0,0:00,0.0,62.0,14.0,11.0,18.0,4.0,10.0,1.0,0.0,0.0,0:00,0.0
16.07.2018,"DWTNCS Season 2, Week 5",16.07.2018,97146,97147,2018-07-16,21:00,Final,Jamie Colleen,96597,Maycee Barber,84541,False,True,KO,3,4:15,Elbows,,,,26.0,40.0,3.0,12.0,37.0,3.0,2.0,0.0,0.0,0:00,0.0,93.0,23.0,47.0,48.0,20.0,44.0,5.0,2.0,0.0,0:00,0.0
16.07.2018,"DWTNCS Season 2, Week 5",16.07.2018,97146,97148,2018-07-16,21:00,Final,Domingo Pilarte,85110,Vince Morales,84699,True,False,SUB,2,1:52,,,Rear Naked Choke,,49.0,11.0,7.0,22.0,7.0,5.0,2.0,1.0,1.0,0:00,0.0,68.0,15.0,10.0,33.0,11.0,10.0,0.0,0.0,0.0,0:00,1.0
16.07.2018,"DWTNCS Season 2, Week 5",16.07.2018,97146,97149,2018-07-16,21:00,Final,Chibwikem Onyenegecha,97150,Anthony Adams,87975,True,False,S Dec,3,5:00,,,,,85.0,13.0,54.0,29.0,9.0,46.0,0.0,0.0,0.0,0:00,0.0,63.0,23.0,21.0,15.0,17.0,19.0,5.0,0.0,0.0,0:00,0.0
16.07.2018,"DWTNCS Season 2, Week 5",16.07.2018,97146,97151,2018-07-16,21:00,Final,Angelo Trevino,97152,Austin Vanderford,97153,False,True,SUB,2,2:42,,,Rear Naked Choke,,69.0,4.0,0.0,38.0,2.0,0.0,3.0,0.0,0.0,0:00,1.0,49.0,5.0,3.0,24.0,4.0,2.0,4.0,0.0,1.0,0:00,0.0
16.07.2018,"DWTNCS Season 2, Week 5",16.07.2018,97146,97154,2018-07-16,21:00,Final,Antonio Jones,97155,Edmen Shahbazyan,84439,False,True,KO,1,0:40,Punches,,,,7.0,2.0,0.0,3.0,2.0,0.0,0.0,0.0,0.0,0:00,0.0,27.0,8.0,0.0,16.0,4.0,0.0,0.0,0.0,0.0,0:00,1.0
22.07.2018,UFC Fight Night: Shogun vs. Smith,22.07.2018,91476,91486,2018-07-22,03:30,Final,Corey Anderson,85543,Glover Teixeira,84291,True,False,Points,3,5:00,,,,"27-30, 27-30, 27-30",87.0,9.0,1.0,39.0,8.0,1.0,19.0,7.0,0.0,0:00,0.0,39.0,7.0,0.0,15.0,5.0,0.0,4.0,0.0,1.0,0:00,0.0
22.07.2018,UFC Fight Night: Shogun vs. Smith,22.07.2018,91476,91487,2018-07-22,03:30,Final,Abu Azaitar,89550,Vitor Miranda,91451,True,False,Points,3,5:00,,,,"28-29, 27-30, 27-30",109.0,15.0,4.0,33.0,11.0,4.0,1.0,1.0,0.0,0:00,0.0,32.0,6.0,7.0,10.0,3.0,6.0,4.0,3.0,1.0,0:00,0.0
22.07.2018,UFC Fight Night: Shogun vs. Smith,22.07.2018,91476,91485,2018-07-22,03:30,Final,Anthony Smith,84592,Mauricio Rua,87842,True,False,KO,1,1:29,Punches,,,,29.0,0.0,2.0,21.0,0.0,2.0,0.0,0.0,0.0,0:00,1.0,7.0,1.0,4.0,0.0,1.0,3.0,0.0,0.0,0.0,0:00,0.0
22.07.2018,UFC Fight Night: Shogun vs. Smith,22.07.2018,91476,91490,2018-07-22,03:30,Final,Nasrat Haqparast,84626,Marc Diakiese,84622,True,False,Points,3,5:00,,,,"26-30, 27-30, 27-30",180.0,11.0,7.0,79.0,7.0,7.0,2.0,0.0,0.0,0:00,1.0,194.0,24.0,2.0,28.0,20.0,2.0,4.0,0.0,0.0,0:00,0.0
22.07.2018,UFC Fight Night: Shogun vs. Smith,22.07.2018,91476,91489,2018-07-22,03:30,Final,David Zawada,85601,Danny Roberts,84516,False,True,S Dec,3,5:00,,,,,51.0,11.0,2.0,21.0,10.0,2.0,5.0,2.0,5.0,0:00,0.0,73.0,6.0,8.0,32.0,6.0,7.0,2.0,0.0,1.0,0:00,0.0
22.07.2018,UFC Fight Night: Shogun vs. Smith,22.07.2018,91476,91484,2018-07-22,03:30,Final,Aleksandar Rakic,84907,Justin Ledet,84328,True,False,Points,3,5:00,,,,"24-30, 24-30, 25-30",122.0,5.0,17.0,88.0,5.0,11.0,4.0,3.0,0.0,0:00,1.0,24.0,0.0,2.0,12.0,0.0,0.0,1.0,0.0,0.0,0:00,0.0
22.07.2018,UFC Fight Night: Shogun vs. Smith,22.07.2018,91476,91488,2018-07-22,03:30,Final,Marcin Tybura,84678,Stefan Struve,84426,True,False,Points,3,5:00,,,,"28-29, 27-30, 27-30",37.0,14.0,17.0,17.0,10.0,14.0,7.0,5.0,0.0,0:00,0.0,64.0,5.0,9.0,20.0,3.0,8.0,0.0,0.0,0.0,0:00,0.0
22.07.2018,UFC Fight Night: Shogun vs. Smith,22.07.2018,91476,91482,2018-07-22,03:30,Final,Emil Meek,86689,Bartosz Fabinski,88075,False,True,Points,3,5:00,,,,"29-28, 29-28, 30-27",60.0,5.0,0.0,20.0,1.0,0.0,0.0,0.0,1.0,0:00,0.0,40.0,5.0,3.0,28.0,4.0,3.0,9.0,6.0,0.0,0:00,0.0
22.07.2018,UFC Fight Night: Shogun vs. Smith,22.07.2018,91476,91481,2018-07-22,03:30,Final,Damir Hadzovic,84435,Nick Hein,84918,True,False,S Dec,3,5:00,,,,,127.0,17.0,11.0,48.0,12.0,11.0,0.0,0.0,0.0,0:00,1.0,182.0,12.0,4.0,32.0,8.0,3.0,0.0,0.0,0.0,0:00,0.0
22.07.2018,UFC Fight Night: Shogun vs. Smith,22.07.2018,91476,91480,2018-07-22,03:30,Final,Liu Pingyuan,85076,Damian Stasiak,91394,True,False,Points,3,5:00,,,,"28-29, 28-29, 27-30",64.0,10.0,3.0,21.0,8.0,3.0,1.0,1.0,2.0,0:00,0.0,29.0,11.0,9.0,11.0,7.0,6.0,8.0,3.0,0.0,0:00,0.0
22.07.2018,UFC Fight Night: Shogun vs. Smith,22.07.2018,91476,91483,2018-07-22,03:30,Final,Khalid Taha,84646,Nad Narimani,84620,False,True,Points,3,5:00,,,,"30-27, 30-27, 30-27",44.0,6.0,7.0,24.0,3.0,5.0,0.0,0.0,0.0,0:00,0.0,56.0,10.0,3.0,37.0,5.0,3.0,11.0,6.0,0.0,0:00,0.0
22.07.2018,UFC Fight Night: Shogun vs. Smith,22.07.2018,91476,91478,2018-07-22,03:30,Final,Darko Stosic,84412,Jeremy Kimball,91479,True,False,KO,1,3:13,Elbows,,,,12.0,2.0,2.0,8.0,0.0,1.0,0.0,0.0,0.0,0:00,0.0,13.0,0.0,3.0,1.0,0.0,3.0,1.0,0.0,0.0,0:00,0.0
22.07.2018,UFC Fight Night: Shogun vs. Smith,22.07.2018,91476,91477,2018-07-22,03:30,Final,Manny Bermudez,84383,Davey Grant,85552,True,False,SUB,1,0:59,,,Triangle Choke,,5.0,0.0,0.0,3.0,0.0,0.0,0.0,0.0,2.0,0:00,1.0,2.0,1.0,3.0,1.0,0.0,3.0,0.0,0.0,0.0,0:00,0.0
23.07.2018,"DWTNCS Season 2, Week 6",23.07.2018,97156,97164,2018-07-23,21:00,Final,Canaan Kawaihae,97165,Chase Hooper,85613,False,True,Points,3,5:00,,,,"28-26, 29-26, 29-26",39.0,9.0,0.0,27.0,8.0,0.0,2.0,0.0,0.0,0:00,1.0,97.0,24.0,3.0,58.0,20.0,3.0,3.0,0.0,3.0,0:00,0.0
23.07.2018,"DWTNCS Season 2, Week 6",23.07.2018,97156,97162,2018-07-23,21:00,Final,Josh Appelt,97163,Jeff Hughes,84477,False,True,KO,1,4:26,Punch,,,,10.0,4.0,1.0,3.0,2.0,1.0,1.0,0.0,0.0,0:00,0.0,69.0,4.0,3.0,44.0,4.0,3.0,3.0,2.0,0.0,0:00,1.0
23.07.2018,"DWTNCS Season 2, Week 6",23.07.2018,97156,97161,2018-07-23,21:00,Final,Sodiq Yusuff,84628,Mike Davis,84937,True,False,Points,3,5:00,,,,"27-30, 27-30, 27-30",173.0,9.0,32.0,76.0,7.0,28.0,1.0,0.0,0.0,0:00,1.0,115.0,34.0,6.0,48.0,23.0,6.0,4.0,0.0,0.0,0:00,0.0
23.07.2018,"DWTNCS Season 2, Week 6",23.07.2018,97156,97159,2018-07-23,21:00,Final,Chris Birchler,97160,Jimmy Crute,84367,False,True,KO,1,4:23,Punch,,,,83.0,5.0,0.0,37.0,4.0,0.0,0.0,0.0,0.0,0:00,0.0,78.0,15.0,7.0,46.0,12.0,7.0,0.0,0.0,0.0,0:00,0.0
23.07.2018,"DWTNCS Season 2, Week 6",23.07.2018,97156,97157,2018-07-23,21:00,Final,Alexander Munoz,86709,Nick Newell,97158,True,False,Points,3,5:00,,,,"27-30, 27-30, 27-30",73.0,12.0,11.0,40.0,10.0,11.0,6.0,4.0,0.0,0:00,0.0,97.0,7.0,10.0,37.0,7.0,9.0,0.0,0.0,0.0,0:00,0.0
28.07.2018,UFC Fight Night: Alvarez vs. Poirier 2,28.07.2018,97166,97179,2018-07-28,17:00,Final,Olivier Aubin-Mercier,85152,Alexander Hernandez,84282,False,True,Points,3,5:00,,,,"29-28, 29-28, 30-27",18.0,11.0,3.0,8.0,9.0,2.0,6.0,2.0,1.0,0:00,0.0,55.0,24.0,2.0,24.0,15.0,0.0,10.0,4.0,0.0,0:00,0.0
28.07.2018,UFC Fight Night: Alvarez vs. Poirier 2,28.07.2018,97166,97178,2018-07-28,17:00,Final,Tecia Torres,84469,Joanna Jedrzejczyk,85518,False,True,Points,3,5:00,,,,"30-27, 30-27, 30-27",44.0,2.0,32.0,11.0,2.0,20.0,10.0,0.0,0.0,0:00,0.0,113.0,38.0,15.0,21.0,27.0,14.0,0.0,0.0,0.0,0:00,0.0
28.07.2018,UFC Fight Night: Alvarez vs. Poirier 2,28.07.2018,97166,97177,2018-07-28,17:00,Final,Jeremy Stephens,84466,Jose Aldo,84318,False,True,KO,1,4:19,Punches,,,,55.0,3.0,2.0,16.0,2.0,2.0,0.0,0.0,0.0,0:00,0.0,55.0,3.0,5.0,21.0,3.0,5.0,0.0,0.0,0.0,0:00,1.0
28.07.2018,UFC Fight Night: Alvarez vs. Poirier 2,28.07.2018,97166,97176,2018-07-28,17:00,Final,Dustin Poirier,84656,Eddie Alvarez,95080,True,False,KO,2,4:05,Punches,,,,101.0,6.0,8.0,44.0,4.0,6.0,0.0,0.0,2.0,0:00,1.0,53.0,15.0,8.0,10.0,10.0,6.0,3.0,0.0,1.0,0:00,0.0
28.07.2018,UFC Fight Night: Alvarez vs. Poirier 2,28.07.2018,97166,97175,2018-07-28,15:00,Final,Ion Cutelaba,84687,Gadzhimurad Antigulov,84780,True,False,KO,1,4:25,Elbows,,,,31.0,15.0,0.0,27.0,13.0,0.0,0.0,0.0,0.0,0:00,0.0,14.0,3.0,1.0,8.0,3.0,1.0,8.0,3.0,0.0,0:00,0.0
28.07.2018,UFC Fight Night: Alvarez vs. Poirier 2,28.07.2018,97166,97174,2018-07-28,15:00,Final,Islam Makhachev,84786,Kajan Johnson,94902,True,False,SUB,1,4:43,,,Armbar,,17.0,1.0,0.0,6.0,1.0,0.0,1.0,1.0,1.0,0:00,0.0,6.0,5.0,6.0,0.0,3.0,4.0,0.0,0.0,0.0,0:00,0.0
28.07.2018,UFC Fight Night: Alvarez vs. Poirier 2,28.07.2018,97166,97173,2018-07-28,15:00,Final,Austin Arnett,84344,Hakeem Dawodu,85309,False,True,Points,3,5:00,,,,"30-27, 30-27, 30-27",67.0,1.0,0.0,22.0,1.0,0.0,4.0,0.0,0.0,0:00,0.0,108.0,18.0,44.0,28.0,8.0,39.0,1.0,0.0,0.0,0:00,0.0
28.07.2018,UFC Fight Night: Alvarez vs. Poirier 2,28.07.2018,97166,97172,2018-07-28,15:00,Final,Alex Morono,84601,Jordan Mein,94303,False,True,Points,3,5:00,,,,"29-28, 29-28, 29-28",59.0,5.0,3.0,15.0,3.0,2.0,0.0,0.0,1.0,0:00,0.0,32.0,3.0,3.0,9.0,3.0,2.0,4.0,3.0,0.0,0:00,0.0
28.07.2018,UFC Fight Night: Alvarez vs. Poirier 2,28.07.2018,97166,97171,2018-07-28,13:00,Final,Alvaro Herrera,95724,Devin Powell,91644,False,True,KO,1,1:52,Kicks,,,,19.0,4.0,0.0,3.0,4.0,0.0,0.0,0.0,0.0,0:00,0.0,14.0,7.0,5.0,3.0,5.0,4.0,1.0,0.0,0.0,0:00,1.0
28.07.2018,UFC Fight Night: Alvarez vs. Poirier 2,28.07.2018,97166,97170,2018-07-28,13:00,Final,Nina Nunes,84863,Randa Markos,84538,True,False,Points,3,5:00,,,,"28-29, 28-29, 28-29",84.0,10.0,24.0,20.0,6.0,23.0,0.0,0.0,0.0,0:33,0.0,68.0,2.0,2.0,20.0,2.0,1.0,11.0,1.0,0.0,4:57,0.0
28.07.2018,UFC Fight Night: Alvarez vs. Poirier 2,28.07.2018,97166,97169,2018-07-28,13:00,Final,Matheus Nicolau,89532,Dustin Ortiz,84274,False,True,KO,1,3:49,Kick,,,,8.0,5.0,3.0,2.0,2.0,3.0,0.0,0.0,0.0,0:00,0.0,37.0,2.0,4.0,6.0,0.0,2.0,0.0,0.0,0.0,0:04,1.0
28.07.2018,UFC Fight Night: Alvarez vs. Poirier 2,28.07.2018,97166,97168,2018-07-28,13:00,Final,Katlyn Chookagian,84866,Alexis Davis,84526,True,False,Points,3,5:00,,,,"27-30, 28-29, 28-29",188.0,11.0,3.0,50.0,9.0,3.0,0.0,0.0,0.0,0:00,0.0,141.0,17.0,43.0,24.0,10.0,36.0,2.0,1.0,0.0,0:00,0.0
28.07.2018,UFC Fight Night: Alvarez vs. Poirier 2,28.07.2018,97166,97167,2018-07-28,13:00,Final,Ross Pearson,84631,John Makdessi,84625,False,True,Points,3,5:00,,,,"29-28, 29-27, 30-26",182.0,15.0,27.0,51.0,9.0,19.0,2.0,0.0,0.0,0:00,0.0,211.0,25.0,25.0,99.0,13.0,19.0,0.0,0.0,0.0,0:00,0.0
30.07.2018,"DWTNCS Season 2, Week 7",30.07.2018,97180,97188,2018-07-30,21:00,Final,Shawn Teed,97189,Juan Adams,84708,False,True,KO,1,4:17,Punches,,,,12.0,2.0,0.0,6.0,0.0,0.0,3.0,0.0,0.0,0:00,0.0,72.0,1.0,0.0,56.0,1.0,0.0,0.0,0.0,0.0,0:00,0.0
30.07.2018,"DWTNCS Season 2, Week 7",30.07.2018,97180,97186,2018-07-30,21:00,Final,Jordan Griffin,85025,Maurice Mitchell,97187,True,False,SUB,1,3:57,,,Rear Naked Choke,,33.0,2.0,0.0,12.0,2.0,0.0,1.0,0.0,1.0,0:00,1.0,19.0,5.0,3.0,9.0,4.0,2.0,0.0,0.0,0.0,0:00,0.0
30.07.2018,"DWTNCS Season 2, Week 7",30.07.2018,97180,97185,2018-07-30,21:00,Final,Justin Sumter,85060,Ian Heinisch,84636,False,True,KO,1,3:37,Elbows,,,,7.0,1.0,2.0,2.0,1.0,2.0,1.0,1.0,0.0,0:00,0.0,13.0,0.0,3.0,8.0,0.0,2.0,0.0,0.0,0.0,0:00,0.0
30.07.2018,"DWTNCS Season 2, Week 7",30.07.2018,97180,97183,2018-07-30,21:00,Final,Mitchell Sipe,97184,Don'Tale Mayes,85100,False,True,KO,2,4:49,Punches,,,,63.0,20.0,12.0,30.0,15.0,9.0,5.0,1.0,0.0,0:00,0.0,165.0,8.0,10.0,89.0,4.0,5.0,0.0,0.0,0.0,0:00,0.0
30.07.2018,"DWTNCS Season 2, Week 7",30.07.2018,97180,97181,2018-07-30,21:00,Final,Garrett Gross,97182,Roosevelt Roberts,84801,False,True,SUB,2,2:13,,,Rear Naked Choke,,8.0,7.0,3.0,4.0,7.0,3.0,1.0,0.0,0.0,0:00,0.0,45.0,2.0,1.0,33.0,2.0,1.0,4.0,3.0,1.0,0:00,0.0
04.08.2018,UFC 227: Dillashaw vs. Garbrandt 2,04.08.2018,97190,97201,2018-08-03,21:00,Final,JJ Aldrich,84542,Polyana Viana,84589,True,False,Points,3,5:00,,,,"27-30, 28-29, 28-29",77.0,5.0,1.0,36.0,3.0,1.0,1.0,0.0,0.0,0:00,0.0,97.0,24.0,8.0,24.0,15.0,7.0,5.0,1.0,0.0,0:00,0.0
04.08.2018,UFC 227: Dillashaw vs. Garbrandt 2,04.08.2018,97190,97202,2018-08-03,21:00,Final,Kevin Holland,84759,Thiago Santos,84421,False,True,Points,3,5:00,,,,"29-26, 29-27, 29-27",41.0,9.0,5.0,20.0,6.0,5.0,1.0,0.0,1.0,0:00,0.0,131.0,17.0,5.0,50.0,14.0,5.0,7.0,3.0,1.0,0:00,0.0
04.08.2018,UFC 227: Dillashaw vs. Garbrandt 2,04.08.2018,97190,97200,2018-08-03,21:00,Final,Renato Moicano,84319,Cub Swanson,84812,True,False,SUB,1,4:15,,,Rear Naked Choke,,42.0,3.0,2.0,14.0,2.0,1.0,2.0,1.0,1.0,0:00,1.0,19.0,5.0,14.0,5.0,3.0,12.0,0.0,0.0,0.0,0:00,0.0
04.08.2018,UFC 227: Dillashaw vs. Garbrandt 2,04.08.2018,97190,97199,2018-08-03,21:00,Final,Henry Cejudo,84286,Demetrious Johnson,93424,True,False,S Dec,5,5:00,,,,,116.0,25.0,6.0,29.0,18.0,4.0,11.0,3.0,0.0,0:00,0.0,62.0,21.0,51.0,23.0,19.0,39.0,2.0,1.0,0.0,0:00,0.0
04.08.2018,UFC 227: Dillashaw vs. Garbrandt 2,04.08.2018,97190,97198,2018-08-03,21:00,Final,Cody Garbrandt,84457,TJ Dillashaw,84268,False,True,KO,1,4:10,Punches,,,,37.0,5.0,1.0,14.0,2.0,1.0,2.0,0.0,0.0,0:00,0.0,60.0,6.0,6.0,37.0,5.0,3.0,0.0,0.0,0.0,0:00,2.0
04.08.2018,UFC 227: Dillashaw vs. Garbrandt 2,04.08.2018,97190,97197,2018-08-03,21:00,Final,Sheymon Moraes,84629,Matt Sayles,84806,True,False,Points,3,5:00,,,,"28-29, 28-29, 28-29",113.0,55.0,4.0,31.0,40.0,2.0,4.0,0.0,0.0,0:00,0.0,185.0,30.0,20.0,39.0,23.0,15.0,3.0,0.0,0.0,0:00,0.0
04.08.2018,UFC 227: Dillashaw vs. Garbrandt 2,04.08.2018,97190,97192,2018-08-03,21:00,Final,Zhang Weili,84470,Danielle Taylor,96070,True,False,Points,3,5:00,,,,"28-29, 28-29, 28-29",107.0,30.0,57.0,31.0,15.0,31.0,2.0,1.0,0.0,0:00,0.0,104.0,11.0,8.0,22.0,8.0,4.0,1.0,0.0,1.0,0:00,0.0
04.08.2018,UFC 227: Dillashaw vs. Garbrandt 2,04.08.2018,97190,97195,2018-08-03,21:00,Final,Montel Jackson,84652,Ricky Simon,84362,False,True,Points,3,5:00,,,,"29-28, 30-27, 30-27",76.0,15.0,3.0,27.0,13.0,2.0,2.0,2.0,0.0,0:00,0.0,31.0,14.0,8.0,7.0,10.0,8.0,20.0,7.0,0.0,0:00,0.0
04.08.2018,UFC 227: Dillashaw vs. Garbrandt 2,04.08.2018,97190,97194,2018-08-03,21:00,Final,Brett Johns,86651,Pedro Munhoz,84458,False,True,Points,3,5:00,,,,"29-27, 29-28, 30-26",153.0,12.0,3.0,61.0,10.0,2.0,6.0,0.0,0.0,0:00,0.0,182.0,31.0,32.0,78.0,16.0,23.0,4.0,0.0,1.0,0:00,3.0
04.08.2018,UFC 227: Dillashaw vs. Garbrandt 2,04.08.2018,97190,97193,2018-08-03,21:00,Final,Wuliji Buren,84340,Marlon Vera,84443,False,True,KO,2,4:53,Punch,,,,32.0,19.0,10.0,16.0,9.0,6.0,4.0,2.0,0.0,0:00,0.0,58.0,13.0,15.0,24.0,8.0,13.0,4.0,1.0,0.0,0:00,1.0
04.08.2018,UFC 227: Dillashaw vs. Garbrandt 2,04.08.2018,97190,97191,2018-08-03,21:00,Final,Jose Torres,97020,Alex Perez,84755,False,True,KO,1,3:46,Punches,,,,67.0,9.0,0.0,22.0,7.0,0.0,0.0,0.0,0.0,0:00,0.0,139.0,16.0,7.0,67.0,11.0,6.0,3.0,0.0,0.0,0:00,1.0
04.08.2018,UFC 227: Dillashaw vs. Garbrandt 2,04.08.2018,97190,97196,2018-08-03,21:00,Final,Kyung Ho Kang,84353,Ricardo Ramos,84309,False,True,S Dec,3,5:00,,,,,120.0,12.0,25.0,38.0,6.0,21.0,2.0,1.0,0.0,0:00,0.0,117.0,13.0,16.0,40.0,6.0,8.0,2.0,1.0,1.0,0:00,0.0
07.08.2018,"DWTNCS Season 2, Week 8",07.08.2018,97203,97204,2018-08-06,21:00,Final,Tebaris Gordon,97205,Greg Hardy,84287,False,True,KO,1,0:17,Punch,,,,5.0,1.0,0.0,0.0,1.0,0.0,0.0,0.0,0.0,0:00,0.0,14.0,4.0,0.0,10.0,4.0,0.0,0.0,0.0,0.0,0:00,1.0
07.08.2018,"DWTNCS Season 2, Week 8",07.08.2018,97203,97206,2018-08-06,21:00,Final,Devonte Smith,84364,Joe Lowry,88287,True,False,KO,1,2:52,Elbows,,,,50.0,1.0,4.0,30.0,0.0,4.0,0.0,0.0,0.0,0:00,1.0,35.0,5.0,0.0,13.0,4.0,0.0,1.0,0.0,0.0,0:00,0.0
07.08.2018,"DWTNCS Season 2, Week 8",07.08.2018,97203,97207,2018-08-06,21:00,Final,Dennis Bryant,97208,Kennedy Nzechukwu,84545,False,True,KO,1,1:48,Kick,,,,18.0,4.0,10.0,5.0,4.0,10.0,0.0,0.0,0.0,0:00,0.0,20.0,1.0,1.0,17.0,1.0,1.0,0.0,0.0,0.0,0:00,1.0
07.08.2018,"DWTNCS Season 2, Week 8",07.08.2018,97203,97209,2018-08-06,21:00,Final,Jacob Kilburn,85610,Bobby Moffett,84727,False,True,SUB,2,1:02,,,D'Arce Choke,,9.0,2.0,3.0,3.0,2.0,3.0,0.0,0.0,0.0,0:00,0.0,29.0,11.0,0.0,20.0,10.0,0.0,2.0,2.0,1.0,0:00,0.0
07.08.2018,"DWTNCS Season 2, Week 8",07.08.2018,97203,97210,2018-08-06,21:00,Final,Alex Gilpin,97211,Marty Coughran,97212,True,False,SUB,2,1:55,,,D'Arce Choke,,83.0,3.0,1.0,45.0,1.0,1.0,4.0,1.0,1.0,0:00,0.0,101.0,34.0,14.0,49.0,22.0,14.0,0.0,0.0,0.0,0:00,0.0
09.08.2018,Dana White's Contender Series: Brazil 1,09.08.2018,97213,97222,2018-08-09,21:00,Final,Mayana Kellem,97223,Mayra Bueno Silva,86740,False,True,SUB,1,1:02,,,Anaconda Choke,,6.0,1.0,2.0,0.0,1.0,1.0,1.0,0.0,0.0,0:00,0.0,4.0,4.0,0.0,1.0,2.0,0.0,0.0,0.0,1.0,0:00,0.0
09.08.2018,Dana White's Contender Series: Brazil 1,09.08.2018,97213,97220,2018-08-09,21:00,Final,Gustavo Gabriel,97221,Rogerio Bontorin,84312,False,True,SUB,2,4:37,,,Rear Naked Choke,,43.0,13.0,4.0,29.0,8.0,2.0,2.0,0.0,0.0,0:00,0.0,57.0,11.0,8.0,25.0,9.0,7.0,4.0,2.0,1.0,0:00,0.0
09.08.2018,Dana White's Contender Series: Brazil 1,09.08.2018,97213,97218,2018-08-09,21:00,Final,Augusto Sakai,84693,Marcos Conrado Jr.,97219,True,False,KO,2,3:09,Punches,,,,106.0,6.0,11.0,66.0,3.0,10.0,0.0,0.0,0.0,0:00,2.0,35.0,2.0,1.0,10.0,2.0,1.0,7.0,1.0,0.0,0:00,0.0
09.08.2018,Dana White's Contender Series: Brazil 1,09.08.2018,97213,97214,2018-08-09,21:00,Final,Sarah Frota,84331,Maiara Amanajas dos Santos,97215,True,False,KO,1,3:26,Punch,,,,122.0,0.0,5.0,79.0,0.0,5.0,1.0,0.0,0.0,0:00,1.0,46.0,1.0,7.0,11.0,1.0,7.0,0.0,0.0,0.0,0:00,0.0
09.08.2018,Dana White's Contender Series: Brazil 1,09.08.2018,97213,97216,2018-08-09,21:00,Final,Diego Henrique da Silva,97217,Antonio Arroyo,85094,False,True,Points,3,5:00,,,,"30-26, 30-26, 30-26",47.0,15.0,4.0,21.0,13.0,4.0,0.0,0.0,0.0,0:00,0.0,41.0,17.0,12.0,21.0,17.0,11.0,11.0,4.0,0.0,0:00,0.0
10.08.2018,Dana White's Contender Series: Brazil 2,10.08.2018,97224,97225,2018-08-10,21:00,Final,Marcio Alexandre Jr.,95220,Leonardo Silva De Oliveira,97226,True,False,SUB,1,1:52,,,Guillotine Choke,,0.0,2.0,0.0,0.0,1.0,0.0,0.0,0.0,1.0,0:00,0.0,3.0,1.0,1.0,1.0,0.0,1.0,6.0,3.0,0.0,0:00,0.0
10.08.2018,Dana White's Contender Series: Brazil 2,10.08.2018,97224,97227,2018-08-10,21:00,Final,Maria de Oliveira Neta,97228,Marina Rodriguez,84549,False,True,KO,1,3:03,Punches,,,,16.0,0.0,3.0,6.0,0.0,2.0,0.0,0.0,0.0,0:00,0.0,30.0,13.0,3.0,20.0,12.0,3.0,1.0,1.0,0.0,0:00,0.0
10.08.2018,Dana White's Contender Series: Brazil 2,10.08.2018,97224,97229,2018-08-10,21:00,Final,Johnny Walker,84327,Henrique da Silva,95957,True,False,Points,3,5:00,,,,"26-30, 27-30, 27-30",100.0,11.0,8.0,63.0,10.0,8.0,1.0,1.0,3.0,0:00,0.0,29.0,31.0,7.0,18.0,28.0,7.0,3.0,0.0,0.0,0:00,0.0
10.08.2018,Dana White's Contender Series: Brazil 2,10.08.2018,97224,97230,2018-08-10,21:00,Final,Estefani Almeida,97231,Taila Santos,84298,False,True,Points,3,5:00,,,,"30-27, 30-27, 30-27",94.0,16.0,17.0,22.0,13.0,12.0,3.0,0.0,0.0,0:00,0.0,121.0,3.0,33.0,56.0,3.0,32.0,1.0,1.0,0.0,0:00,0.0
10.08.2018,Dana White's Contender Series: Brazil 2,10.08.2018,97224,97232,2018-08-10,21:00,Final,Bruno Assis,97233,Andre Muniz,85433,False,True,Points,3,5:00,,,,"30-26, 30-27, 30-27",36.0,7.0,1.0,13.0,5.0,1.0,4.0,2.0,1.0,0:00,0.0,66.0,6.0,4.0,41.0,4.0,3.0,9.0,3.0,0.0,0:00,0.0
25.08.2018,UFC Fight Night: Gaethje vs. Vick,25.08.2018,97234,97243,2018-08-24,21:00,Final,Andre Fili,84408,Michael Johnson,84743,False,True,S Dec,3,5:00,,,,,104.0,12.0,1.0,25.0,11.0,1.0,4.0,2.0,1.0,0:00,0.0,67.0,36.0,13.0,31.0,22.0,12.0,3.0,0.0,0.0,0:00,0.0
25.08.2018,UFC Fight Night: Gaethje vs. Vick,25.08.2018,97234,97246,2018-08-24,21:00,Final,Deiveson Figueiredo,84530,John Moraga,91353,True,False,KO,2,3:08,Punch,,,,30.0,9.0,0.0,20.0,9.0,0.0,4.0,2.0,1.0,0:00,2.0,17.0,7.0,2.0,6.0,6.0,2.0,2.0,0.0,1.0,0:00,0.0
25.08.2018,UFC Fight Night: Gaethje vs. Vick,25.08.2018,97234,97245,2018-08-24,21:00,Final,Bryan Barberena,84405,Jake Ellenberger,91298,True,False,KO,1,2:26,Punch,,,,33.0,1.0,1.0,17.0,1.0,1.0,0.0,0.0,0.0,0:00,2.0,8.0,2.0,4.0,6.0,2.0,4.0,0.0,0.0,0.0,0:00,0.0
25.08.2018,UFC Fight Night: Gaethje vs. Vick,25.08.2018,97234,97244,2018-08-24,21:00,Final,Angela Hill,84539,Cortney Casey,84398,False,True,S Dec,3,5:00,,,,,156.0,41.0,25.0,65.0,34.0,22.0,1.0,1.0,0.0,0:00,0.0,290.0,28.0,15.0,80.0,17.0,14.0,6.0,1.0,0.0,0:00,0.0
25.08.2018,UFC Fight Night: Gaethje vs. Vick,25.08.2018,97234,97247,2018-08-24,21:00,Final,Tim Williams,96903,Eryk Anders,84660,False,True,KO,3,4:42,Kick,,,,89.0,13.0,11.0,29.0,5.0,9.0,5.0,2.0,0.0,0:00,0.0,80.0,13.0,0.0,30.0,12.0,0.0,1.0,0.0,0.0,0:00,2.0
25.08.2018,UFC Fight Night: Gaethje vs. Vick,25.08.2018,97234,97242,2018-08-24,21:00,Final,James Vick,84395,Justin Gaethje,84552,False,True,KO,1,1:27,Punch,,,,9.0,8.0,3.0,3.0,5.0,2.0,0.0,0.0,0.0,0:00,0.0,8.0,3.0,4.0,3.0,2.0,2.0,0.0,0.0,0.0,0:00,1.0
25.08.2018,UFC Fight Night: Gaethje vs. Vick,25.08.2018,97234,97238,2018-08-24,21:00,Final,Warlley Alves,84893,James Krause,85560,False,True,KO,2,2:28,Flying Knee,,,,47.0,13.0,4.0,20.0,6.0,2.0,1.0,1.0,0.0,0:00,0.0,83.0,19.0,4.0,43.0,14.0,2.0,4.0,0.0,0.0,0:00,0.0
25.08.2018,UFC Fight Night: Gaethje vs. Vick,25.08.2018,97234,97240,2018-08-24,21:00,Final,Markus Perez,84294,Andrew Sanchez,84714,False,True,Points,3,5:00,,,,"29-28, 29-28, 29-28",79.0,38.0,5.0,22.0,29.0,3.0,1.0,0.0,0.0,0:00,0.0,119.0,27.0,13.0,44.0,21.0,8.0,6.0,0.0,0.0,0:00,0.0
25.08.2018,UFC Fight Night: Gaethje vs. Vick,25.08.2018,97234,97239,2018-08-24,21:00,Final,Iuri Alcantara,93610,Cory Sandhagen,84285,False,True,KO,2,1:01,Punches,,,,24.0,0.0,0.0,9.0,0.0,0.0,1.0,1.0,2.0,0:00,0.0,112.0,0.0,1.0,65.0,0.0,1.0,0.0,0.0,0.0,0:00,0.0
25.08.2018,UFC Fight Night: Gaethje vs. Vick,25.08.2018,97234,97237,2018-08-24,21:00,Final,Luke Sanders,84375,Rani Yahya,84361,False,True,SUB,1,1:31,,,Heel Hook,,4.0,0.0,0.0,2.0,0.0,0.0,0.0,0.0,0.0,0:00,0.0,4.0,1.0,3.0,1.0,1.0,2.0,2.0,0.0,2.0,0:00,0.0
25.08.2018,UFC Fight Night: Gaethje vs. Vick,25.08.2018,97234,97236,2018-08-24,21:00,Final,Jon Tuck,91419,Drew Dober,84483,False,True,Points,3,5:00,,,,"30-26, 30-26, 30-27",53.0,15.0,7.0,16.0,10.0,7.0,1.0,0.0,1.0,0:00,0.0,111.0,13.0,12.0,42.0,9.0,9.0,2.0,2.0,0.0,0:00,0.0
25.08.2018,UFC Fight Night: Gaethje vs. Vick,25.08.2018,97234,97235,2018-08-24,21:00,Final,Kalindra Faria,96682,Joanne Calderwood,84283,False,True,SUB,1,4:57,,,Armbar,,13.0,4.0,0.0,10.0,3.0,0.0,1.0,1.0,0.0,0:00,0.0,5.0,0.0,1.0,4.0,0.0,1.0,0.0,0.0,2.0,0:00,0.0
25.08.2018,UFC Fight Night: Gaethje vs. Vick,25.08.2018,97234,97241,2018-08-24,21:00,Final,George Sullivan,94662,Mickey Gall,84473,False,True,SUB,1,1:09,,,Rear Naked Choke,,0.0,0.0,0.0,0.0,0.0,0.0,0.0,0.0,0.0,0:00,0.0,2.0,0.0,0.0,0.0,0.0,0.0,1.0,1.0,1.0,0:00,0.0
08.09.2018,UFC 228: Woodley vs. Till,08.09.2018,97248,97261,2018-09-08,11:00,Final,Niko Price,84608,Abdul Razak Alhassan,87819,False,True,KO,1,0:43,Punches,,,,6.0,4.0,0.0,2.0,2.0,0.0,1.0,0.0,0.0,0:00,0.0,17.0,3.0,1.0,11.0,3.0,1.0,0.0,0.0,0.0,0:00,1.0
08.09.2018,UFC 228: Woodley vs. Till,08.09.2018,97248,97260,2018-09-08,11:00,Final,Jimmie Rivera,84380,John Dodson,84432,True,False,Points,3,5:00,,,,"28-29, 27-30, 27-30",79.0,21.0,25.0,25.0,16.0,21.0,3.0,0.0,0.0,0:00,0.0,95.0,17.0,5.0,21.0,15.0,5.0,1.0,0.0,0.0,0:00,0.0
08.09.2018,UFC 228: Woodley vs. Till,08.09.2018,97248,97259,2018-09-08,11:00,Final,Zabit Magomedsharipov,84467,Brandon Davis,84766,True,False,SUB,2,3:46,,,Kneebar,,40.0,4.0,9.0,26.0,4.0,8.0,7.0,6.0,1.0,0:00,0.0,37.0,15.0,17.0,8.0,7.0,12.0,0.0,0.0,0.0,0:00,0.0
08.09.2018,UFC 228: Woodley vs. Till,08.09.2018,97248,97258,2018-09-08,11:00,Final,Karolina Kowalkiewicz,84554,Jessica Andrade,84826,False,True,KO,1,1:58,Punch,,,,46.0,6.0,4.0,15.0,5.0,4.0,0.0,0.0,0.0,0:00,0.0,66.0,5.0,2.0,32.0,4.0,2.0,0.0,0.0,0.0,0:00,1.0
08.09.2018,UFC 228: Woodley vs. Till,08.09.2018,97248,97257,2018-09-08,11:00,Final,Darren Till,84504,Tyron Woodley,84461,False,True,SUB,2,4:19,,,D'Arce Choke,,6.0,0.0,0.0,0.0,0.0,0.0,0.0,0.0,0.0,0:00,0.0,67.0,9.0,3.0,47.0,7.0,3.0,4.0,0.0,1.0,0:00,1.0
08.09.2018,UFC 228: Woodley vs. Till,08.09.2018,97248,97256,2018-09-08,11:00,Final,Darren Stewart,84869,Charles Byrd,84440,True,False,KO,2,2:17,Elbow,,,,58.0,6.0,1.0,17.0,6.0,1.0,0.0,0.0,0.0,0:00,1.0,55.0,4.0,4.0,32.0,3.0,3.0,3.0,0.0,0.0,0:00,0.0
08.09.2018,UFC 228: Woodley vs. Till,08.09.2018,97248,97255,2018-09-08,11:00,Final,Frank Camacho,84956,Geoff Neal,84256,False,True,KO,2,1:23,Kick,,,,40.0,14.0,3.0,12.0,10.0,3.0,2.0,0.0,0.0,0:00,0.0,98.0,4.0,0.0,56.0,3.0,0.0,0.0,0.0,0.0,0:00,2.0
08.09.2018,UFC 228: Woodley vs. Till,08.09.2018,97248,97254,2018-09-08,11:00,Final,Cody Stamann,84642,Aljamain Sterling,84381,False,True,SUB,2,3:42,,,Kneebar,,31.0,7.0,5.0,2.0,6.0,4.0,3.0,3.0,0.0,0:00,0.0,56.0,13.0,5.0,23.0,7.0,3.0,9.0,2.0,2.0,0:00,0.0
08.09.2018,UFC 228: Woodley vs. Till,08.09.2018,97248,97253,2018-09-08,11:00,Final,Tatiana Suarez,84864,Carla Esparza,84691,True,False,KO,3,4:33,Punches,,,,77.0,18.0,3.0,64.0,15.0,3.0,11.0,9.0,0.0,0:00,0.0,5.0,5.0,0.0,1.0,5.0,0.0,2.0,0.0,0.0,0:00,0.0
08.09.2018,UFC 228: Woodley vs. Till,08.09.2018,97248,97252,2018-09-08,11:00,Final,Jarred Brooks,96539,Roberto Sanchez,96563,True,False,S Dec,3,5:00,,,,,31.0,7.0,4.0,15.0,7.0,2.0,4.0,2.0,1.0,0:00,0.0,30.0,9.0,1.0,10.0,6.0,0.0,4.0,1.0,0.0,0:00,0.0
08.09.2018,UFC 228: Woodley vs. Till,08.09.2018,97248,97251,2018-09-08,11:00,Final,Lucie Pudilova,84424,Irene Aldana,84820,False,True,S Dec,3,5:00,,,,,289.0,20.0,20.0,81.0,11.0,13.0,0.0,0.0,0.0,0:00,0.0,164.0,23.0,39.0,80.0,10.0,29.0,1.0,0.0,0.0,0:00,0.0
08.09.2018,UFC 228: Woodley vs. Till,08.09.2018,97248,97250,2018-09-08,11:00,Final,Alex White,84604,Jim Miller,84685,False,True,SUB,1,1:29,,,Rear Naked Choke,,11.0,3.0,0.0,3.0,2.0,0.0,0.0,0.0,0.0,0:00,0.0,19.0,2.0,3.0,11.0,2.0,2.0,1.0,1.0,1.0,0:00,0.0
08.09.2018,UFC 228: Woodley vs. Till,08.09.2018,97248,97249,2018-09-08,11:00,Final,Craig White,97012,Diego Sanchez,84472,False,True,Points,3,5:00,,,,"30-27, 30-27, 30-27",39.0,3.0,0.0,16.0,2.0,0.0,0.0,0.0,1.0,0:00,1.0,65.0,12.0,0.0,34.0,12.0,0.0,4.0,3.0,0.0,0:00,0.0
15.09.2018,UFC Fight Night: Hunt vs. Oleinik,15.09.2018,97262,97276,2018-09-14,21:00,Final,Thiago Alves,84300,Aleksei Kunchenko,85327,False,True,Points,3,5:00,,,,"29-28, 29-28, 30-27",0.0,0.0,0.0,0.0,0.0,0.0,0.0,0.0,0.0,0:00,0.0,0.0,0.0,0.0,0.0,0.0,0.0,0.0,0.0,0.0,0:00,0.0
15.09.2018,UFC Fight Night: Hunt vs. Oleinik,15.09.2018,97262,97275,2018-09-14,21:00,Final,Shamil Abdurakhimov,84677,Andrei Arlovski,84694,True,False,Points,3,5:00,,,,"27-30, 27-30, 28-29",0.0,0.0,0.0,0.0,0.0,0.0,0.0,0.0,0.0,0:00,0.0,0.0,0.0,0.0,0.0,0.0,0.0,0.0,0.0,0.0,0:00,0.0
15.09.2018,UFC Fight Night: Hunt vs. Oleinik,15.09.2018,97262,97274,2018-09-14,21:00,Final,Nikita Krylov,84654,Jan Blachowicz,84420,False,True,SUB,2,2:41,,,Arm Triangle,,14.0,5.0,3.0,3.0,0.0,1.0,1.0,1.0,1.0,0:00,0.0,17.0,1.0,0.0,10.0,0.0,0.0,1.0,1.0,1.0,0:00,0.0
15.09.2018,UFC Fight Night: Hunt vs. Oleinik,15.09.2018,97262,97273,2018-09-14,21:00,Final,Aleksei Oleinik,84815,Mark Hunt,93302,True,False,SUB,1,4:26,,,Rear Naked Choke,,0.0,0.0,0.0,0.0,0.0,0.0,0.0,0.0,0.0,0:00,0.0,0.0,0.0,0.0,0.0,0.0,0.0,0.0,0.0,0.0,0:00,0.0
15.09.2018,UFC Fight Night: Hunt vs. Oleinik,15.09.2018,97262,97272,2018-09-14,21:00,Final,Terrion Ware,96477,Merab Dvalishvili,84711,False,True,Points,3,5:00,,,,"30-25, 30-25, 30-25",28.0,5.0,1.0,5.0,3.0,0.0,0.0,0.0,0.0,0:00,0.0,149.0,8.0,8.0,51.0,5.0,6.0,8.0,5.0,0.0,0:00,0.0
15.09.2018,UFC Fight Night: Hunt vs. Oleinik,15.09.2018,97262,97271,2018-09-14,21:00,Final,Stefan Sekulic,90573,Ramazan Emeev,84415,False,True,Points,3,5:00,,,,"30-26, 30-27, 29-28",34.0,9.0,15.0,6.0,3.0,13.0,5.0,1.0,0.0,0:00,0.0,64.0,17.0,3.0,22.0,12.0,2.0,3.0,2.0,1.0,0:00,1.0
15.09.2018,UFC Fight Night: Hunt vs. Oleinik,15.09.2018,97262,97269,2018-09-14,21:00,Final,Jordan Johnson,96311,Adam Yandiev,97270,True,False,SUB,2,0:42,,,Arm Triangle,,0.0,0.0,0.0,0.0,0.0,0.0,0.0,0.0,0.0,0:00,0.0,0.0,0.0,0.0,0.0,0.0,0.0,0.0,0.0,0.0,0:00,0.0
15.09.2018,UFC Fight Night: Hunt vs. Oleinik,15.09.2018,97262,97268,2018-09-14,21:00,Final,Marcin Prachnio,88004,Magomed Ankalaev,84411,False,True,KO,1,3:09,Kick,,,,0.0,0.0,0.0,0.0,0.0,0.0,0.0,0.0,0.0,0:00,0.0,0.0,0.0,0.0,0.0,0.0,0.0,0.0,0.0,0.0,0:00,0.0
15.09.2018,UFC Fight Night: Hunt vs. Oleinik,15.09.2018,97262,97267,2018-09-14,21:00,Final,Desmond Green,84632,Mairbek Taisumov,85223,False,True,Points,3,5:00,,,,"30-27, 30-27, 30-27",0.0,0.0,0.0,0.0,0.0,0.0,0.0,0.0,0.0,0:00,0.0,0.0,0.0,0.0,0.0,0.0,0.0,0.0,0.0,0.0,0:00,0.0
15.09.2018,UFC Fight Night: Hunt vs. Oleinik,15.09.2018,97262,97266,2018-09-14,21:00,Final,Kajan Johnson,94902,Rustam Khabilov,84582,False,True,S Dec,3,5:00,,,,,85.0,10.0,28.0,15.0,6.0,23.0,0.0,0.0,0.0,0:00,0.0,64.0,6.0,0.0,16.0,1.0,0.0,8.0,3.0,0.0,0:00,0.0
15.09.2018,UFC Fight Night: Hunt vs. Oleinik,15.09.2018,97262,97265,2018-09-14,21:00,Final,Jin Soo Son,85112,Petr Yan,84433,False,True,Points,3,5:00,,,,"29-28, 30-27, 30-27",0.0,0.0,0.0,0.0,0.0,0.0,0.0,0.0,0.0,0:00,0.0,0.0,0.0,0.0,0.0,0.0,0.0,0.0,0.0,0.0,0:00,0.0
